,5
keyword,dimensions of inequality
clasification,No Poverty
gpt2_0,"dimensions of inequality — and their own political dynamics. In short, this case may be about how to put the interests of different segments of society into perspective rather than just about how to build an economy.

The challenge for the Left is being"
gpt2_1,"dimensions of inequality"" and, he added, ""we need to acknowledge that we have an incomplete picture of how to live our dreams.""

He cited one of the most recent polls: University of Cambridge sociology professor Michael Lewis. He suggested that"
gpt2_2,"dimensions of inequality,"" with the largest differences between the richest and poorest quintiles of America being income-related. By contrast, the highest income quintile of the country was the top 1 percent of those aged 15 and higher. While the poverty rate"
gpt2_3,"dimensions of inequality, which the new system finds distasteful. It proposes ""prolonged punishment""—punishment for anyone who had made a mistake that led to the deaths of all the rest of us.

Poverty is, under"
gpt2_4,"dimensions of inequality in the U.S. and Canada, where some countries offer better living standards but fewer opportunities – in large measure, the problem is that the gains of those countries are shared by many.

The question now on international political"
gpt2_5,"dimensions of inequality.""

To be sure, some of the main conclusions of the report on inequality were drawn from economic and empirical studies of the effects of capital on inequality, and from comparative analyses of public expenditures by states and private firms that examined"
gpt2_6,"dimensions of inequality, a few of the same arguments with the support of some of the most important people in history.


Fifty-one million more Mexicans.

-


If that's not a great estimate for those who live"
gpt2_7,dimensions of inequality in the United Nation's official statistics that show more people are concentrated in regions with very low and very high poverty rates. While the poverty and upward mobility gap within industrialized nations has increased because of the success of the World Trade Organization or
gpt2_8,"dimensions of inequality, but not for political purposes. For this reason, economic class divides do not lead to equality among the classes or to the social order. It depends, on the contrary, on a social order for it to prosper.

"
gpt2_9,"dimensions of inequality in which women work or live and where they choose to live are quite different in these categories. In addition to gender differences in housing affordability, it is true the share of men working has grown.

The main reason is that"
gpt2_10,"dimensions of inequality in the United States, are often considered too complex to address in their current form, and it will take long to do so with a wide range of measures.

The second factor to consider in making the issue of inequality one"
gpt2_11,"dimensions of inequality and inequality. Some of the most important recent economic research by social economists, including the U.S. Department of the Treasury's Hayek, shows that income and wealth inequality do not appear to be decreasing at all, despite the"
gpt2_12,"dimensions of inequality. The more we can achieve social justice and justice for all the African Americans in our own way, the more we will eventually be able to achieve it. It turns out that in a lot of places, African Americans hold more political"
gpt2_13,"dimensions of inequality were found in the highest quintile of socioeconomic status. Within this quintile, more men owned more wealth than women in total wealth, in absolute and in all other categories, and in total disposable wealth compared with women in that quint"
gpt2_14,"dimensions of inequality (i.e., the degree of stratification relative to other social classes).

(b) A social group has social groups, such that any one of those social groups has an intrinsic or underlying quality of being an economic"
gpt2_15,"dimensions of inequality and segregation.

[18] This includes the effects of the financial crisis on communities and workplaces that are not in work. To mitigate such inequities, we should create an equal opportunity foundation for all U.S. families"
gpt2_16,"dimensions of inequality in these countries.

The main concern of policymakers, especially the U.S.; in particular, their decisionmakers, will have to address this issue is whether we are going to be getting much of a deal on inequality in"
gpt2_17,"dimensions of inequality in Germany's economy, including in the employment gap and in the share of men in work, have increased in recent years but are still low. A growing share of Germans have worked part time, or only marginally.

F"
gpt2_18,"dimensions of inequality, I am more than willing to give you a hard time about this one. First of all, your job is to fix inequality. And I am more than willing to accept that, in the meantime, you can afford to pay"
gpt2_19,"dimensions of inequality between the rich and poor—the extent to which this explains economic mobility—is uncertain. Although higher taxes are likely to pay for these rising inequality, it does not appear that increasing inequality through taxes on households should reverse them.
"
neo_0,"dimensions of inequality,"" which was in essence a restatement of the famous Simpson-Bowles Commission.

There is plenty of evidence to prove that the United States now faces a serious crisis of inequality, especially in the distribution of income and"
neo_1,"dimensions of inequality in the country, but has also been critical of the fact that the same groups (white, older, etc.) have remained in power since independence. A key task was to identify people who could be trusted with the government, including"
neo_2,"dimensions of inequality that remain a constant. There is no mention of how people are being helped out in between.

The one big difference between the Republican approach and the Democratic one is that the Republicans have to have their cake and eat it too"
neo_3,"dimensions of inequality and the power of equality, _Inequality, Politics, and Gender,_ ed. Judith D. Levenson and Jane Mansbridge, Routledge, New York, 1987, pp. 63–64.

"
neo_4,"dimensions of inequality, the problem of the underprivileged is everywhere, so, whatever the source, whatever the ideology, whatever the structure, whatever the politics, the problem always remains: where is the money?

_'What matters more"
neo_5,"dimensions of inequality” (Bakir et al. 1996).

A particular case of inequality in the distribution of social power is the lack of equality of opportunities to obtain education. An important problem is the under-representation of historically"
neo_6,"dimensions of inequality: ‘The Rich Get Richer’ and the ‘Poor Get’d’ – the former from the fact that the wealthiest 5% control 30% of the wealth in the world, and the latter from"
neo_7,dimensions of inequality: (1) racial discrimination that makes it difficult to secure quality service to minority groups; (2) racial discrimination in hiring and promotion; (3) racial discrimination in hiring and promotion that is based on membership in a protected minority
neo_8,"dimensions of inequality in a range.

However, the inequality’s relevance has been increasingly contested as it has become recognized that even small social inequalities are associated with substantial health disparities. It is time we ask a larger question: Do inequalities"
neo_9,"dimensions of inequality: gender, race, education, income, occupation, nationality, immigration, religion and sexuality.

The gap in life expectancy between men and women varies between countries and from district to district, but the gap in mortality between different"
neo_10,"dimensions of inequality has been used to understand many different phenomena in economics, politics and public management. More recent work has found that the distribution of income is not as unimportant as one may think. We look at the importance of inequality and some of"
neo_11,"dimensions of inequality that are very often overlooked and underestimated by the general public.

The idea behind this piece is to bring to light the various dimensions of inequality that are very often overlooked and underestimated by the general public. It is important to take"
neo_12,"dimensions of inequality (p=.05):

  * • The poor are more likely than the middle class to believe that the government has a responsibility to provide affordable health insurance.

  * • The poor would rather pay an increase of taxes"
neo_13,"dimensions of inequality in the US:

The top one per cent of Americans own 40% of the US's total wealth.

The top 0.1% of households own nearly 20% of the US's total wealth.

"
neo_14,"dimensions of inequality as well as the gender/sexuality dimensions. Furthermore, gender and gender/sexuality dimensions appear as both predictors and outcomes when all types of gender are included. This is in keeping with the finding that gender stereotypes and gender"
neo_15,"dimensions of inequality.

In the last decade, the world has been rocked by the rise of populism, particularly around the globe. As countries increasingly rely on income redistribution to fund social safety nets, social mobility has been threatened.
According to"
neo_16,"dimensions of inequality to the dimension of inequality in the context of our results.

\[exam:square\_sigma\_prime\] For $\sigma$ as in Example \[exam:square\], $\"
neo_17,"dimensions of inequality were substantially lower than for either of the income groups considered by the National Academy in their 1976 report, which compared the top tenth with the middle tenth.[12]

The top tenth income group's income share was 13.5"
neo_18,"dimensions of inequality\]) can be derived independently of the specific values of $k,m,n$. In particular, when $m\neq n$, the inequality (\[c:inequality\_2\]) does not hold"
neo_19,"dimensions of inequality is not based on what the law states, but what the law does not state.

The law of the land says, ""Boys can go into the girls' bathroom without asking for permission."" What the law does not"
