,7
keyword,economic marginalisation
clasification,No Poverty
gpt2_0,"economic marginalisation of the left. By and large Labour is far from being a left wing party, not even half its size or growing. It's far from representing the entire left.

Labour did not win the election, but there are many"
gpt2_1,"economic marginalisation of the private sector. By creating opportunities for those with higher levels of social mobility, the government plans to promote growth and economic self-sufficiency, but with higher taxation rates and lower social protection.

I am speaking from the"
gpt2_2,"economic marginalisation of the middle class is not entirely unique and is quite normal for that group.""

Facebook Twitter Pinterest A man walks past a sign that says 'Migrants only need food' outside the supermarket in Calais, France. Photograph: E"
gpt2_3,"economic marginalisation was only temporarily diminished; and that the level at which people were able to escape economic misery remained as much as it had been. The level of national productivity also continued to reach its average level at this point, or near the level of"
gpt2_4,"economic marginalisation of the middle class was one major problem. There is now a ""cultural Marxist"" view that the political system ""needs to evolve,"" according to the most recent book on the issues: ""Capitalists are not about to leave, and"
gpt2_5,"economic marginalisation, and which may be seen as an essential aspect of the policy. There are many issues for an economic policy to be successful, and I think the most important for an economy to be successful is what is achieved by what is not achieved"
gpt2_6,"economic marginalisation to the point where the marginalised benefit could be lost due to a lack of capacity to repay.

The government's plan is based on a ""systematic structural adjustment in its accounting base"", according to the draft guidance.
"
gpt2_7,"economic marginalisation of China's rich class, which has pushed poor people out of their economic self-support, is now being replicated in the United States. It is time to reverse these trends.

As recently as 1996 the US Census Bureau reported"
gpt2_8,"economic marginalisation in Africa and the Middle East.

The most recent European Parliament (EP) statistics are as follows:

Population: 27.5 million (2013)

Source: Eurostat: www.ec.europa."
gpt2_9,"economic marginalisation in a globalised economy is being made all the more dire.

There are few other arguments as compelling, as the evidence reveals.

This is the first time in more than 20 years this year that a government policymaker"
gpt2_10,"economic marginalisation, even though the social policies are designed with marginalising working class populations.

The left's emphasis on marginalising working class populations is misleading when one thinks that this means that economic policy should be more ""marginalising,"" with"
gpt2_11,"economic marginalisation is the result of a major economic adjustment.

Why is Canada so far outstripping China on this one?

This is a question that can be asked over the course of two courses, first, about the relationship of"
gpt2_12,"economic marginalisation and the need for effective, accountable financial markets"", argues that the Bank of England has no need for the Reserve Bank's monetary policy. ""That has not been shown. We are currently in a situation in which our monetary policy needs to"
gpt2_13,"economic marginalisation of Australia's political class and policy preferences and is an act of nationalisation and cultural imperialism.

The country is therefore subject to serious criticism for its poor governance, under-representation of low-income Australians, and an unwillingness"
gpt2_14,economic marginalisation. These are the same sorts of conditions that are found in China and that are the real threat to the region—even if they are not necessarily a serious threat to the way our economic landscape looks for people. That is the main reason
gpt2_15,"economic marginalisation"" - it's an interesting case.

Image copyright Thinkstock Image caption South Koreans have taken to social media to protest against this move

Yet, in many ways, this is one more case than its ""one-hit"
gpt2_16,"economic marginalisation that was evident in the 1990s. While the government argued that these changes had been driven by the ""recession"" in the private sector, it did not fully reflect the reality that a massive economic crash would come only gradually.
"
gpt2_17,"economic marginalisation to the extent necessary.

The question that the Australian Labour Party faces now remains, as the leader of the federal party, whether there will be one of the two main currents of radical left-wing political action in Parliament to resist"
gpt2_18,"economic marginalisation of the UK - an economic recovery that has caused an economic slowdown since the crisis and has meant an upward pressure from recession.

Mr Cameron has made several economic announcements including the 'GDP target', which seeks to raise Britain's"
gpt2_19,"economic marginalisation of labour, this means that the working class will face higher costs to meet their labour needs and that they will be forced to pay more for the ""equity of life"". The wage premium and employment guarantee will be increased and the labour"
neo_0,"economic marginalisation and marginalisation in different age groups. The age-based mortality index was created by categorising age into five groups: \<45 years, 45--89 years, ≥90 years, and unknown. Mortality by age was determined"
neo_1,"economic marginalisation on women to be considered in the analysis of gender differences in health among South Asian women.

Conclusion {#s5}
==========

South Asian women face important health needs that can be substantially ameliorated by"
neo_2,"economic marginalisation of all sections of the working class and the working class in turn is being progressively pushed towards more extreme positions in its relations with the state.

_Second, there is a political contradiction between the trade union movement and the working class"
neo_3,"economic marginalisation from the health care system, leading to a shortage of doctors and increasing the demand for their services by poorer patients.^[@r17]^ Thus, in Brazil, a gap must be created among the private and public healthcare sectors"
neo_4,"economic marginalisation. The 'leftward shift' of the Italian left, for example, has been a function of the relative decline of the Communist parties and the rise of the Italian Social Movement (MSI) since the 1960s. The MSI,"
neo_5,"economic marginalisation.

The report is timely. It is timely because it signals the beginning of the return to the political process and the emergence of the political economy of our time. It is timely because it signals the beginning of a new and different"
neo_6,"economic marginalisation. The fact the government cannot be seen as
inherently corrupting to the society is, therefore, a sign that the
government is not corrupting the society.

The second
significance of this, as"
neo_7,"economic marginalisation. It means he is also marginal to the decision-makers who want him to go to Washington.

How can a Prime Minister who has no political base in the country be in touch with the real people?

In terms"
neo_8,"economic marginalisation of women and people from diverse backgrounds, and also to address the structural inequalities that can lead to marginalisation based on gender and ethnicity, race and age.

This is a crucial moment for us to have the ability to harness our"
neo_9,"economic marginalisation in England and Wales

  [@bib40]                                 NUTS"
neo_10,"economic marginalisation: that is, to make sure that people have enough money to be able to go to work and pay taxes that support the public sector, and to provide for themselves. But in the post-2008 world, this is no longer a"
neo_11,"economic marginalisation and class consciousness. The only difference between class as described in the 1920s and the 1990s was that in the late twentieth century class was understood not just as a social and economic formation but also as a political one.

The"
neo_12,"economic marginalisation  Eligible population: *N* (million) and *N* (%) for each country\
   1.1. Total number of live births\
  "
neo_13,"economic marginalisation, a term coined by the author of ""The New Class War."" This is a class politics of exclusion and marginalization, which sees social divisions based on class – like the black/white, male/female, old/young,"
neo_14,"economic marginalisation and is used to predict the probability of a particular individual becoming homeless in their lifetime.  The calculation of the relative poverty-level is based on the size of the individuals' individual income.

The method of the calculation is similar"
neo_15,"economic marginalisation, and it is difficult to see how either of these could ever be reversed.



As for the third point, I am not exactly certain why economic marginalisation would be a good thing in a world of free speech. First"
neo_16,"economic marginalisation and exclusion. This approach has, however, been limited and there remains a need for more innovative approaches in terms of identifying specific risks and early signs of exclusion to enable interventions early. Therefore, further work is required to understand how exclusion operates"
neo_17,"economic marginalisation of the working class, who increasingly live on government social benefit and housing allowances, with a higher proportion at risk of unemployment – as a result of the capitalist class’s attempt to break the class solidarity of the working class. But"
neo_18,"economic marginalisation of the state at the same time as it seeks to establish itself as the dominant power within the region.

As a result, the state has found itself in a unique and precarious situation: whilst it has become more dependent on the"
neo_19,"economic marginalisation, inequality, and lack of economic and social support for the poor and vulnerable ([@B15]; [@B5]; [@B12], [@B11]).

This study was conducted in the most populous province of"
