,27
keyword,poor resilience
clasification,No Poverty
gpt2_0,"poor resilience. There are also questions about why this is. If your parents aren't in hospice care and you're in a group home with a therapist who will listen, you may not have a good understanding of what the family needs. Most parents"
gpt2_1,"poor resilience in children,"" said Dr. Philip Wood, chief of research at the American College of Child and Adolescent Psychiatry, who co-led the study for Johns Hopkins University. ""But in fact, the data show that children are better able to"
gpt2_2,"poor resilience as well as other skills required for high-risk behaviour.

These and many others may seem obvious, but they really don't. If you're getting into a risky situation and the person you're in has high standards of behaviour who"
gpt2_3,"poor resilience. He made the decision to give up his life after a fight to save his baby girl.

A judge ordered Mr Dyer to pay out at least £80,000 ($90,000) on top of his bail.
"
gpt2_4,"poor resilience, but he also needs to be able to deal with what is happening to the people, both within and outside of it.

""We hope he is able to adapt and adapt to change,"" he continued.

In a statement"
gpt2_5,"poor resilience"" -- the ""sadness of all people.""

After 9/11 the United States provided $1 billion to build the Twin Towers. And though many details still remain unclear, the New York Times is reporting that some of those"
gpt2_6,"poor resilience, which also goes back to the point that when people do get sick the system would be better off if they stayed home and weren't suffering from diabetes,"" Smith concludes.

Some of the most recent cases are in Texas. Of 6"
gpt2_7,"poor resilience and a combination of individual responsibility and community service (i.e., more caring, more compassionate to those who seek assistance and more responsible to those who are not). It is clear from these studies that many of the strategies I described above do"
gpt2_8,"poor resilience. Some women are still suffering.

That's not about to change

The issue, though, is about what she doesn't understand, that is, the nature of this problem. There is no ""reform"", we see"
gpt2_9,"poor resilience. It would be really cool if he'd been able to handle himself and continue to help other girls.

This story was written by The Daily Sheeple and does not necessarily reflect the opinion of the editorial board or Bloomberg LP and its"
gpt2_10,"poor resilience.

For me the hardest part about the game of chess is that its lack of strategy. Although a lot of the games on it are not that interesting, it doesn't take time to realise what is going on there. It's"
gpt2_11,"poor resilience to the stress of conflict;

4. Self-control and self-assertion by individuals with an intergenerational background

5. The ability to adapt to changes in social conditions

The importance of family relationships to individual"
gpt2_12,"poor resilience, an extreme range, and a number of other characteristics that can make these traits valuable.

The strength and durability of resilience are highly variable in species and their environmental environments. When it comes to these characteristics, the average life expectancy of"
gpt2_13,"poor resilience and personal growth.""

""Being able to deal with adversity in a way that makes you feel confident and happy is essential,"" he said.""

'Strong-willed'

Rachael Lough, president of the"
gpt2_14,"poor resilience and self-control when dealing with adversity and adversity in general, and an even more resilient perspective, when dealing with stress and grief, even among the more vulnerable.

The concept of resilience can also make it easier for people to develop"
gpt2_15,"poor resilience) to adversity is important to improve their health when it comes to mental health for working mothers.

In general, health needs differ widely across the spectrum of children and families. Some children need support from their caregivers (e.g.,"
gpt2_16,"poor resilience and good citizenship.

But more and more Canadians think immigrants don't deserve to get jobs here.

The latest report by the Canadian Institute of Peace and Prosperity, for the Institute for Fiscal Studies published on Thursday, says immigrants"
gpt2_17,"poor resilience among African-Americans,"" says David Pugh, the director of the University of Texas at Austin's Center for Research on Race and the Education of Our Culture.

Pugh worked with Pugh in the Obama administration and was recruited to"
gpt2_18,"poor resilience or resistance.

But for most of the modern world, the problem lies in the cultural background, where the most important thing to remember is that the person in question is a woman. This is an important question to avoid being influenced in"
gpt2_19,"poor resilience. If such a strong man were to fail at some point in his life, he would not be the same man. Yet in our age of unprecedented changes, this is not surprising: in the 19th century, for instance, one thing"
neo_0,"poor resilience has to be shown. And this, if I understand, is what the other group is doing:

""I have an almost pathological fear of risk. I don’t like to take risks. I don’t like"
neo_1,"poor resilience, you’ve made it through the night, you can handle anything, and you’ve got everyone counting on you and expecting the world from you. Then it all comes crashing down. Or maybe it’s that you"
neo_2,"poor resilience or 'resilience' ([@B43]).

![**(A,B)** Effect of temperature on the maximum number of replicates and the number of replicates for which *p* \< 0.05"
neo_3,"poor resilience and adaptability). Similarly, a ""good"" leader could be described as one who is able to identify his or her own weaknesses and weaknesses in others and is able to ""draw the boundary"" between ""good"" and ""bad"" leadership"
neo_4,poor resilience' and 'negative resilience.' The following four items capture these constructs: 'I have a habit of keeping busy and happy.' 'I have learned to bounce back from things that I've gone through in my life.' 'I can bounce back
neo_5,poor resilience.                                               
neo_6,"poor resilience to the effects of the cold.""

I can also think of how the cold helps in some ways: ""I always thought that if you froze, you were still you, but even with a freezer full of ice cubes, who could"
neo_7,poor resilience. It's very unusual and it's a very strong sign of stress that you're trying to hold it together for the sake of your partner. You're trying to hold it together so that they don't have a meltdown. It's very
neo_8,"poor resilience,"" a measure of how well people can maintain their social networks in the face of significant loss. It's a standard measure used to assess the mental and emotional health of individuals and families after extreme events such as natural disasters or terrorism attacks. A"
neo_9,"poor resilience of the American Indian. The idea of Indian ""Independence"" is
""Indo-Nationalism"".

~~~
jasonlotito
> The question isn't about, ""Should they be allowed to assimilate?""."
neo_10,"poor resilience (see [Figs. S2--S4](#jpe13161-supitem-0001){ref-type=""supplementary-material""}). Nevertheless, the average *β* value for this plot is negative ("
neo_11,"poor resilience and courage to endure, and also the will to take action, the ability to work in teams or the ability to take on new challenges.

**_The ability to communicate clearly_**

Some people may appear to be able"
neo_12,"poor resilience"" and to not be able to sustain a good level of self-control, so ""you could lose it"" and ""you would do things"" (p. 14). However, there was some evidence that parents whose children had been"
neo_13,"poor resilience' (Patel, 2002) that has been identified in a range of research. In one study, researchers found that people with low psychological resilience (i.e. the capacity to recover negative emotions) did a poor job at managing stress"
neo_14,"poor resilience"" in patients with RA. However, there is insufficient information to suggest that RA patients with high levels of resilience are better off than those with low resilience. The current study revealed that the resilience level of RA patients did not affect the outcomes of"
neo_15,"poor resilience to be able to tolerate such conditions.

What can you do about it?

First, it can be useful to understand the causes of your resilience deficiency and assess how you feel about them.

Secondly, I recommend that"
neo_16,"poor resilience of men and women is not only a natural part of their nature but has been an essential part of human social evolution. It is not the natural ability to survive in the face of adversity that has given human survival over the ages, but rather"
neo_17,"poor resilience for an increasing number of years."" ""He's not quite ready."" ""He just needed a little kick-start, and now we're back in the groove."" ""That's the good news."" ""And the bad news is that there"
neo_18,"poor resilience and resilience is found in the field of medicine, where the term 'vitalism' is used to describe the ability to withstand and overcome any adversity that is life threatening, and where the term 'resilience' is discussed with reference"
neo_19,"poor resilience to the effects of stress.

I didn’t have time to do the research for this post, as we had a big snow day, but based on our first-hand research I feel that you would be correct. We"
