,25
keyword,povertly line
clasification,No Poverty
gpt2_0,"povertly line that means both:

""I know that my body is always growing, and that my head is growing back. And so I want people to know that I am healthy, that I'm having fun.

They also"
gpt2_1,"povertly line-up for all the World Series games at AT&T Park.

The Pirates, in an exchange traded for first baseman Scott King in a blockbuster trade for outfielder Stephen Strasburg, signed starter Johnathan Danks late in"
gpt2_2,"povertly line-to-point from that I wrote for this issue. He also mentioned a few things it does in other ways, such as the addition of new keywords that makes it more interesting.

The thing that most intrigued me about"
gpt2_3,"povertly line this up with that much more than the 5 years that the U.S. government spent in the Cold War, with Iraq costing billions of dollars. It's no secret that the country would have been more secure if the Iraq wars"
gpt2_4,"povertly line-oriented, it works flawlessly. If using a different backend, I'd recommend an alternative one that works better.

What you need is the new ""dockmapper"" function that runs the following command. You"
gpt2_5,"povertly line the bottom left with a white flag, and the first line is the name of the building in question (and the one that has the highest grade). The more information you have, you will be able to be more aware. There"
gpt2_6,"povertly line with his mouth, because you could've said he was gay and done something with his sexuality as a couple of weeks ago when he was on this podcast. He still says that he wasn't gay. When I ask him if he"
gpt2_7,"povertly line your hand and press them to your thigh, then keep pressing your hand downward until your breast lifts up. When your nipple rises to a height of about 10 to 12 inches, press the thumb against the base of your thumb. Repeat"
gpt2_8,"povertly line up with the man. The man and I exchanged an audible look of hostility before closing the door behind us and sitting down at each other's elbows.""

But the man was in a hurry. ""I am going back and"
gpt2_9,"povertly line will not print to the terminal if it gets to an error. It turns the current point into a ""nay turn."" The command does this automatically, so it's best to use one that is fast enough to have a good"
gpt2_10,"povertly line the value on the main screen. As each line specifies what they will do, it will try to find the desired part of the screen, for example a game screen on which to execute a command or a program. This will then"
gpt2_11,"povertly line-up

Vermont Senator Bernie Sanders, at center, waves to supporters during his rally at the Vermont State Capitol in Burlington, on April 12, 2016. (Steve Helber/AP)

Sen. Sanders"
gpt2_12,"povertly line it up, but we'll try to stick a lot more ""normal"" patterns on it. Here is one where we should put our own words in:

<div>

What is a ""line""?

"
gpt2_13,"povertly line: [iHUDControlQuest (18000805)].ihudwidgetscript.initialize() - ""iHUDWidgetScript.psc"" Line 31 [iHUDControlQuest (18000805)].ihudcontrolscript.startUp()"
gpt2_14,"povertly lineed with the color of a moon, though, had always to be considered. It had always been that way in American folklore. The story from time immemorial, however, of a woman's magic flying by with a broom"
gpt2_15,"povertly line in a line up.

For the first part of this example it turns out we need to create a list of the most popular URLs and for the second part we write the following code using the same approach:

use"
gpt2_16,"povertly line. Note that the original file is compressed according to the format used at the time you use it. It is thus recommended that you use LZJ format.

You can also use the following as an argument when you have"
gpt2_17,"povertly line of command,

and is set in the

\begin{casesafe} \begin{casesafe} \begin{casesafe} - \begin{casesafe, lines} A := \begin{casesafe"
gpt2_18,"povertly line their faces like a pterodactyl.

Dissolves: Stasis

In order to learn to control a chameleon, you need to learn that chameleon's primary skill is to hide and"
gpt2_19,"povertly line is a great way to keep your browser and internet browsing organized.

5) In order for your site to function within Google or Yahoo you'll need to create a new tab to the left of your search bar. Choose a"
neo_0,"povertly line-drawn, the last of
the world's great artists. In the centre, with his back to the
perspective represented, sits a dainty blonde girl, with a hand
raised to her eyes and a"
neo_1,"povertly line a large area of a table with a series of lines of code that are intended to create a visual effect. The code should work well but be readable.

The first task is to determine the color of all the lines and"
neo_2,"povertly line, and
a little way down it, you will see a pretty little pond, in which there
was once a wild trout or two, but in the year last past the water has been
somewhat over-run"
neo_3,"povertly line,

The moon at half past four,

The fire was dying as night crept in,

The wind was moaning through the trees,

The leaves were trembling,

And the moon was a w"
neo_4,"povertly line. 
The second sentence also does not make the comparison sound any more persuasive. It suggests that there is a ""line of reasoning"" between two points, while the first sentence simply suggests that one point is a more ""pro"
neo_5,"povertly line: i’m not surprised that he is doing well so far,
otherwise he would not be in the lead. i don’t think he needs a rest.
i believe he was playing very efficiently while"
neo_6,"povertly line."" ""I don't understand this."" ""I'd hoped to have you here by then."" ""I'm so happy to be back."" ""Is this the place where you put the girls?"" ""Yes."" ""I wouldn't"
neo_7,"povertly line-by-line. He is constantly being called on to make changes, changes that he, and his team, do not anticipate at all. The same goes for the other teams in the league. The Toronto Maple Leafs do not"
neo_8,"povertly line-of-sight) [@kop95].

For the sake of the present discussion, we will focus on the “true” line-of-sight, which, in the spherical symmetry assumed above,"
neo_9,"povertly line of sight"" are also significant concerns, especially in cases
where the vehicle is moving or it is not apparent to the person entering the
vehicle whether or not the person is actually inside. As explained in
Blackwell v"
neo_10,"povertly line’, which was ‘only’ two to the line. As you’re very quickly learning the history of the game, the rule change changed the way we’re scoring the game. It was the"
neo_11,"povertly line, but by the time they reached the hotel the sun would be
up and the streets in a blaze of brilliant color.

As soon as they entered the waiting room and could see who it was, the
man who"
neo_12,"povertly line as he came.

The night sky was dark and deep and still and empty, and the stars hung motionless. The moon had passed without bringing rain, and the clouds had passed without bringing snow. The moon was shining"
neo_13,"povertly line up with that. Maybe those guys can
just play for a year or two and then go back to being regular
coaches. That would be a shame, but maybe that is their lot in life.

But to"
neo_14,"povertly line up with the facts that are often made to fit a bad idea is that the ‘right’ kind of gun is the one that has the bullets in the best places. That is, if the best places on the target"
neo_15,"povertly line-searched for a suitable and timely gift to our children.

The most thoughtful gifts are those that can be given at a time of need.

Each Christmas, the boys received new, handmade wooden toys and"
neo_16,"povertly line this time. The man who had set her free from his chains now had a new victim on his hands and no idea how many innocent lives he had lost to his misguided quest for vengeance.

""I'm tired of living"
neo_17,"povertly line-by-line code-by-code analysis. In reality, it is a combination of a number of different types of analyses, and this is where the differences between the methods come in, to begin with, the fact that"
neo_18,"povertly line) and a lower surface (that has a substantially flat lower face but is not completely flat and may be non-planar). Furthermore, the upper surface of the lower surface of the first contact member must have a substantially plano"
neo_19,"povertly line with the testimony contained in the letter. Further, when asked how he thought the statements could have affected a verdict, counsel gave his simple response:
That's why I say that you heard it all the way through. And I"
