,Link,Date,Media,Title,Article,Summary
28,https://www.vaticannews.va/en/world/news/2018-10/world-food-day-united-nations-fao-graziano-message.html,"Tue, 16 Oct 2018 07:00:00 GMT",Vatican News,World Food Day: FAO says Zero Hunger World by 2030 still possible,"The FAO is warning that number of hungry people worldwide has been growing for 3 consecutive years. (ANSA)

José Graziano da Silva, the Director-General of the United Nations Food and Agriculture Organization (FAO) has released a video message on the occasion of the World Food Day, October 16.

By Robin Gomes

The United Nations Food and Agriculture Organization (FAO) is urging nations, continents, sectors and professions to join forces and take action to eliminate hunger, saying a Zero Hunger World by 2030 is still possible. FAO Director-General José Graziano da Silva made the call in a video message on the occasion of World Food Day that was marked worldwide on Tuesday.

FAO marks World Food Day each year on 16 October to highlight the need to step up efforts to end hunger and malnutrition in the world.

The theme of this year’s observance is ""Our actions are our future. A #ZeroHunger world by 2030 is possible"". Various events are being held in over 130 countries, including at the FAO headquarters in Rome, to mark World Food Day.

Listen to our report

Three years ago, in September 2015, all UN Member States approved the 2030 Agenda for Sustainable Development. The Agenda’s Sustainable Development Goal (SDG) number 2 aims at the eradication of hunger and all forms of malnutrition. This SDG was defined by world leaders as an indispensable condition for a safer, fairer and more peaceful world.

In his message, Graziano pointed out that this year’s World Food Day was taking place at a critical moment in the fight against hunger and malnutrition.

Growing number of hungry

The FAO Director-General noted that for 3 consecutive years, the number of hungry people worldwide has been growing and the trend showed the world was returning to levels of 10 years ago. According to the latest “State of Food Security in the World” report, nearly 820 million people were undernourished in 2017.



Graziano noted that conflicts, extreme weather events linked to climate change and economic slowdown were reversing the progress made in the fight against hunger.

He also noted that overweight and obesity levels were growing rapidly. The FAO chief said it was time the world community redoubled its efforts to achieve the global goal of Zero Hunger.

Joining forces against hunger, malnutrition

The FAO Director-General said this year’s World Day calls on the international community to work more closely together, and make use of the evidence and tools available. Three years ago, he noted, “all UN Member Countries pledged to end poverty and hunger, when they committed to the Sustainable Development Goals.”

“Zero Hunger,” Graziano said, “is still achievable if we join forces across nations, continents, sectors and professions, in the remaining years for 2030.” “ Taking action is not an option, Graziano stressed, adding, “ It is a necessary step to a truly sustainable future for all.”

Noting that our present actions will determine our future, Graziano said that a Zero Hunger World by 2030 is still possible.","(ANSA)José Graziano da Silva, the Director-General of the United Nations Food and Agriculture Organization (FAO) has released a video message on the occasion of the World Food Day, October 16.
By Robin GomesThe United Nations Food and Agriculture Organization (FAO) is urging nations, continents, sectors and professions to join forces and take action to eliminate hunger, saying a Zero Hunger World by 2030 is still possible.
FAO Director-General José Graziano da Silva made the call in a video message on the occasion of World Food Day that was marked worldwide on Tuesday.
FAO marks World Food Day each year on 16 October to highlight the need to step up efforts to end hunger and malnutrition in the world.
Various events are being held in over 130 countries, including at the FAO headquarters in Rome, to mark World Food Day."
29,https://newsone.com/3831892/world-food-day-hunger-african-americans-oprah-chance-the-rapper/,"Tue, 16 Oct 2018 07:00:00 GMT",News One,"From Oprah To Chance The Rapper, African-Americans Are Trying To Fight Hunger In Practical Ways","NewsOne Featured Video CLOSE

People across the globe were having a collective moment of raising awareness about the hunger crisis on Tuesday, which marked World Food Day. Hunger, inextricably linked to poverty, disproportionally affects African-Americans, motivating many Black folks to find practical ways to fight to end the crisis.

RELATED: NYC Public School System Battles Childhood Hunger With Free Lunch To All Students

Oprah Winfrey, who has long used her influence and celebrity status to call attention to human rights issues such as hunger, volunteered at the Freestore Foodbank in Cincinnati last month. The mogul partnered with retail company Kroger to attack hunger, WKRC, a CBS and CW affiliate, reported.

“Every step to zero hunger in this country, this city, this world is a step in the right direction,” Winfrey said at the time, spotlighting an issue that the United Nations said it hoped to completely eradicate by 2030.

The crisis hits home for many people nationwide, but for African-Americans, it’s been even worse. Black people are more than twice as likely to face hunger, according to Feeding America. That was widely connected to high poverty rates among Blacks — more than twice that of white, non-Hispanic households in 2017.

With such a high poverty rate, it is no wonder why African Americans are trying to fight back. Volunteers, farmers, activists and celebrities alike are all using their power to make a difference to combat hunger.

For instance, Chance the Rapper has played a role in trying to combat hunger in his native Chicago. The lyricist had teamed up with Lyft to donate $1 million to the city’s schools, and his gift can go a long way in helping provide breakfast and lunch for hungry students.

T.I. also recently decided to pay for a year’s worth of school lunches for a teenager in Florida. A high school had reportedly denied food to the teen, Danielle Aiken because she was 15 cents short in August.

Perhaps other rappers will also donate money for institutions in their home cities and help students afford school meals. The National School Lunch Program allows for 100,000 schools to serve school lunches to 30 million students each day. The program provides 20 million free lunches, 2 million reduced-price lunches in which students pay $0.40 each and 8 million full price lunches, according to the School Nutrition Association.

If more people support families struggling to provide meals for their school-age children and global hunger efforts, then the UN’s goal of ending hunger in just 12 years could come true.

SEE ALSO:

Sarah Huckabee Sanders Gets Complaint Filed Against Her Because Of Kanye West Photo

Lost In The World: Photos Of Kanye West’s Bizarre Trip To Uganda","Hunger, inextricably linked to poverty, disproportionally affects African-Americans, motivating many Black folks to find practical ways to fight to end the crisis.
That was widely connected to high poverty rates among Blacks — more than twice that of white, non-Hispanic households in 2017.
With such a high poverty rate, it is no wonder why African Americans are trying to fight back.
A high school had reportedly denied food to the teen, Danielle Aiken because she was 15 cents short in August.
The National School Lunch Program allows for 100,000 schools to serve school lunches to 30 million students each day."
30,https://www.modernghana.com/news/892147/chefs-in-ghana-call-for-stakeholder-collaborations.html,"Mon, 22 Oct 2018 07:00:00 GMT",Modern Ghana,Chefs In Ghana Call For Stakeholder Collaborations Towards Achieving Zero Hunger By 2030 On International Chefs Day,"Since its creation by late Chef Dr. Bill Gallagher in 2004, chefs across the world have committed to using International Chefs Day to celebrate their noble profession, always remembering that it is their duty to pass on knowledge and culinary skills to the next generation with a sense of pride and commitment to the future.

Nestlé Ghana partnered with Ghana Education Service and chefs from the Chefs Association of Ghana to organize a Nestlé for Healthier Kids community cooking session on Friday 19thOctober, with children from the Asafo Agona East District Assembly Basic School in Central region.

Under the theme “Healthy Foods for Growing Up”, the children were grouped based on their career aspirations and guided by chefs to prepare recipes with local, familiar ingredients.

Speaking to the media, founder of Food for All Africa and member of the Chefs Association of Ghana, Chef Elijah Amoo Addo called on stakeholders within Ghana’s food supply chain to collaborate with chefs in accelerating Ghana’s effort towards attaining Zero Hunger targets by 2030.

“As chefs we believe in a better future for food. A future where ingredients are grown with respect for the environment, where no good food goes to waste and where everyone, everywhere enjoys the nutritious meals they need to grow and thrive.Chefs bridge the gap between the farm and the fork – transforming raw ingredients into delicious, nutritious meals. In doing so, we influence what our farmers grow, what we put on our plates and how we think and talk about food.

We play a critical role in ensuring Ghana meets the targets of the UN Sustainable Development Goals 2, 3 and 12, as such there is the need for greater collaborations with stakeholders. Healthy dietary and lifestyle patterns from an early age could positively impact on peoples nutrition and health throughout their adult lives, and enhance the increase in productivity of individuals and their nation.”

He concluded by commending Nestlé Ghana for leading the cause through their non-branded Nestlé for Healthier Kids project and their commitment in fulfilling their 2030 global ambition to help 50 million children lead healthier lives.","Nestlé Ghana partnered with Ghana Education Service and chefs from the Chefs Association of Ghana to organize a Nestlé for Healthier Kids community cooking session on Friday 19thOctober, with children from the Asafo Agona East District Assembly Basic School in Central region.
Under the theme “Healthy Foods for Growing Up”, the children were grouped based on their career aspirations and guided by chefs to prepare recipes with local, familiar ingredients.
“As chefs we believe in a better future for food.
In doing so, we influence what our farmers grow, what we put on our plates and how we think and talk about food.
We play a critical role in ensuring Ghana meets the targets of the UN Sustainable Development Goals 2, 3 and 12, as such there is the need for greater collaborations with stakeholders."
31,https://newsghana.com.gh/ghanaian-chefs-call-for-stakeholder-collaboration-towards-achieving-zero-hunger-by-2030/,"Wed, 24 Oct 2018 07:00:00 GMT",News Ghana,Ghanaian Chefs Call for stakeholder collaboration towards achieving Zero Hunger by 2030,"Since its creation by late Chef Dr. Bill Gallagher in 2004, chefs across the world have committed to using International Chefs Day to celebrate their noble profession, always remembering that it is their duty to pass on knowledge and culinary skills to the next generation with a sense of pride and commitment to the future.



Nestlé Ghana partnered with Ghana Education Service and chefs from the Chefs Association of Ghana to organize a Nestlé for Healthier Kids community cooking session on Friday 19th October, with children from the Asafo Agona East District Assembly Basic School in Central region.

Under the theme “Healthy Foods for Growing Up”, the children were grouped based on their career aspirations and guided by chefs to prepare recipes with local, familiar ingredients.

Speaking to the media, founder of Food for All Africa and member of the Chefs Association of Ghana, Chef Elijah Amoo Addo called on stakeholders within Ghana’s food supply chain to collaborate with chefs in accelerating Ghana’s effort towards attaining Zero Hunger targets by 2030.

“As chefs we believe in a better future for food. A future where ingredients are grown with respect for the environment, where no good food goes to waste and where everyone, everywhere enjoys the nutritious meals they need to grow and thrive.

Chefs bridge the gap between the farm and the fork – transforming raw ingredients into delicious, nutritious meals. In doing so, we influence what our farmers grow, what we put on our plates and how we think and talk about food.

We play a critical role in ensuring Ghana meets the targets of the UN Sustainable Development Goals 2, 3 and 12, as such there is the need for greater collaborations with stakeholders.

Healthy dietary and lifestyle patterns from an early age could positively impact on peoples nutrition and health throughout their adult lives, and enhance the increase in productivity of individuals and their nation.”

He concluded by commending Nestlé Ghana for leading the cause through their non-branded Nestlé for Healthier Kids project and their commitment in fulfilling their 2030 global ambition to help 50 million children lead healthier lives.

Food for All Africa","Nestlé Ghana partnered with Ghana Education Service and chefs from the Chefs Association of Ghana to organize a Nestlé for Healthier Kids community cooking session on Friday 19th October, with children from the Asafo Agona East District Assembly Basic School in Central region.
Under the theme “Healthy Foods for Growing Up”, the children were grouped based on their career aspirations and guided by chefs to prepare recipes with local, familiar ingredients.
Speaking to the media, founder of Food for All Africa and member of the Chefs Association of Ghana, Chef Elijah Amoo Addo called on stakeholders within Ghana’s food supply chain to collaborate with chefs in accelerating Ghana’s effort towards attaining Zero Hunger targets by 2030.
A future where ingredients are grown with respect for the environment, where no good food goes to waste and where everyone, everywhere enjoys the nutritious meals they need to grow and thrive.
Chefs bridge the gap between the farm and the fork – transforming raw ingredients into delicious, nutritious meals."
32,https://www.hutchnews.com/news/20181004/waste-not-dillons-initiative-is-chasing-goal-of-zero-waste,"Thu, 04 Oct 2018 07:00:00 GMT",The Hutchinson News,Waste not: Dillons initiative is chasing a goal of zero waste,"Dillons stores are celebrating a year of implementing the Zero Huger/Zero Waste initiative, which seeks to improve communities by solving both hunger and food waste.

According to the U.N. Food and Agriculture Organization, 40 percent of the food produced in the U.S. is thrown away. At the same time, more than 10 percent of Americans struggle with hunger, reports the U.S. Department of Agriculture.

As part of the Kroger/Dillons-wide initiative, employees are taking a closer look at every aspect of the business and brainstorming ways to cut back on waste. Environmental accountability is gaining momentum in the corporate sector, with several major corporations like Walmart, Texas Instruments and Estee Lauder setting similar goals.

In Dillons stores, everything -- from unsold food items in the deli to shipping pallets -- can be directed away from landfills, says Sheila Lowrie, corporate affairs manager of Dillons.

“Each department has a way they can contribute to this movement,” Lowrie said.

In Hutchinson, the Dillons Marketplace store on 30th Avenue is diverting 79.19 percent of waste. The goal is to divert 90 percent company-wide by 2025.

Recycling takes no extra effort from employees -- the time spent collecting and throwing away trash is instead used for recycling. And employees are also using the recycling tips learned on the job at home.

“We weren’t doing the best of jobs before and we’ve come so far,"" said Dillons Marketplace Store Manager Mike Matney. ""When you go from throwing 20 to 30 trash cans out every day to throwing away none, you know you’re making a difference in the environment and the community,”

Other Dillons stores in Hutchinson are participating, but the Marketplace store is serving as a flagship that can develop solutions for others.

“We selected this store because it’s so large and there are so many departments,"" Lowrie said. ""If we can achieve it here, we can achieve it in other stores.”

Redirect

Fruit and vegetables with minor blemishes that would normally be thrown away are bagged and sold for a discount or donated to the Reno County Food Bank. Meat that hasn’t sold, but is still good to eat, is frozen and also donated.

“So far this year in our division, we were able to provide 100,000 meals since this time last year because of our focus on rescued food for donations,” Lowrie said.

Penny Taapken, director of the Reno County Food Bank, explained that donations straight from the store improve what she can offer area families.

“Clients can go out with more fresh produce, dairy, whatever they send us. That’s a supplement to what they’re able to receive,” Taapken said. “They all appreciate it; sometimes they come in amazed at what’s available.”

What can’t be donated can be diverted. The food bank can’t accept pre-made foods like sandwiches or cakes past their prime, but those can still be good for animals.

Meat trimmings from the deli department are used to make dog treats. Produce or bakery items are used to make feed for cattle.

“They take apart the sandwiches we have here so the meat goes in the meat rendering bin and the bread and cheese go in the food diversion bin. They’re doing a great job of making sure everything gets to the right place,” said Ben Hughes, expense manager for Dillons. “The cows love it when there are doughnuts. They love the sweet stuff.”

The resulting feed is kept in-state by going to Struther's Ranch in North Milton.

“Not only are we helping the environment, we’re also helping local companies,” Hughes said.

Improvements can still be made, such as in the floral department. Flowers and trimmings could be composted, but it isn’t cost effective.

“It’s a matter of having someone who will do it,"" Hughes explained. ""Composting is very expensive. There are divisions that compost, but it takes a lot of space. If you’ve been out to the dump, you’ll see rows and rows of composting that have to be constantly turned.”

Recycle

The first line of defense for non-food items is source reduction, Lowrie said. This includes smart ordering practices and returning shipping pallets for future use.

What can’t be reduced can often be recycled. Large pallets are sent back on the salvage truck to reuse, but reusing quarter pallets isn’t as easy. Instead, the store began selling them to crafters interested in making home decorations and other craft projects.

While employees make a number of changes behind the scenes, customers can also make small changes to lessen their impact on the environment.

“Every day, we use 6 billion bags throughout the whole Kroger company. About 10 percent of those bags are recycled every year,” Lowrie said. “So many of our customers are using reusable bags today, so we’d like to encourage this.”","Dillons stores are celebrating a year of implementing the Zero Huger/Zero Waste initiative, which seeks to improve communities by solving both hunger and food waste.
As part of the Kroger/Dillons-wide initiative, employees are taking a closer look at every aspect of the business and brainstorming ways to cut back on waste.
In Dillons stores, everything -- from unsold food items in the deli to shipping pallets -- can be directed away from landfills, says Sheila Lowrie, corporate affairs manager of Dillons.
In Hutchinson, the Dillons Marketplace store on 30th Avenue is diverting 79.19 percent of waste.
“We weren’t doing the best of jobs before and we’ve come so far,"" said Dillons Marketplace Store Manager Mike Matney."
33,https://news.un.org/en/story/2018/11/1024772,"Fri, 02 Nov 2018 07:00:00 GMT",UN News,More countries partner to target ‘zero hunger’ in global south,"The Changsha Declaration aims to ramp up the efforts towards South-South Cooperation - an initiative working to eliminate hunger and malnutrition through the mutual sharing and exchange of good practices, resources, and know-how between countries of the “global south”.

At the forum’s conclusion, 26 countries and 11 international organizations signed on to the Declaration, which includes more information-sharing towards constructing common policies and programmes.

The forum coincided with the launch of a new report, jointly published by the Food and Agriculture Organization (FAO), the UN Children’s Fund (UNICEF), World Food Programme (WFP), and the World Health Organization (WHO), alerting of severe food shortages plaguing Asia and the Pacific.

The region faces risk of “a colossal human loss” if countries in the region do not recommit themselves to ending all forms of malnutrition, regional experts from the four specialized UN agencies warned in a joint press release on Friday.

One recent large-scale example of cooperation can be seen in Bangladesh, where hundreds-of-thousands of displaced mainly-Rohingya refugees fleeing violence, faced a major hunger crisis, effecting the whole region. China has been fielding experts and technicians to share knowledge in various technical areas, including aquaculture, crop production and livestock breeding to boost the country’s agriculture sector.

Around the world, climate-related disasters, limited access to safe water, and violence have contributed to a general rise in malnutrition.

Director-General for FAO Jose Graziano da Silva announced plans to establish an International Centre of Excellence for Agriculture Innovation and Rural Development in Beijing during the forum; a facility that will provide training in agriculture innovation and promote investment in rural areas in an effort to reach the first 2030 Sustainable Development Goal of zero hunger.","The Changsha Declaration aims to ramp up the efforts towards South-South Cooperation - an initiative working to eliminate hunger and malnutrition through the mutual sharing and exchange of good practices, resources, and know-how between countries of the “global south”.
At the forum’s conclusion, 26 countries and 11 international organizations signed on to the Declaration, which includes more information-sharing towards constructing common policies and programmes.
The forum coincided with the launch of a new report, jointly published by the Food and Agriculture Organization (FAO), the UN Children’s Fund (UNICEF), World Food Programme (WFP), and the World Health Organization (WHO), alerting of severe food shortages plaguing Asia and the Pacific.
One recent large-scale example of cooperation can be seen in Bangladesh, where hundreds-of-thousands of displaced mainly-Rohingya refugees fleeing violence, faced a major hunger crisis, effecting the whole region.
Around the world, climate-related disasters, limited access to safe water, and violence have contributed to a general rise in malnutrition."
