,Link,Date,Media,Title,Article,Summary
7,https://www.indepthnews.net/index.php/global-governance/un-insider/1787-agroecology-key-element-to-zero-hunger-and-food-security,"Fri, 06 Apr 2018 07:00:00 GMT",IDN InDepthNews | Analysis That Matters,Agroecology Key Element to Zero Hunger and Food Security - IDN-InDepthNews,"UN Insider

Agroecology Key Element to Zero Hunger and Food Security

By Jaya Ramachandran

ROME (IDN) – More than enough food is produced in the world to feed everyone, yet 815 million people go hungry, according to FAO, the Food and Agriculture Organization of the United Nations. How to ensure that a growing global population – projected to rise to around 10 billion by 2050 – will have enough food to meet their nutritional needs, is therefore one of the greatest challenges the world faces. Experts see in agroecology a solution.

Agroecology, they say, can help transition to sustainable food and agriculture systems that ensure food security and nutrition for all, provide social and economic equity and conserve biodiversity and the ecosystem services on which agriculture depends.

Family farmers must remain central to bringing agroecology to scale, FAO Director-General José Graziano da Silva stressed in his closing remarks to the Second International Agroecology Symposium from April 3-5 at FAO in Rome.

""It's time to scale up the implementation of agroecology,"" Graziano da Silva said. ""We have succeeded in moving from talking about what is agroecology, to now having specific program targets to be achieved in the next few years, and strong support from civil society and those governments who have worked hard to make this symposium a success,"" he added.

""When we speak of agroecology, we are not speaking of strictly technical matters. I would like to stress the social aspect, so when we say that we are going to strengthen the role of agroecology in FAO's work, we are saying that we are going to strengthen the role of family and small-scale farmers, fisher folk, pastoralists, women and youth,"" he said.

The FAO Director-General also highlighted the Decade of Family Farming (2019-2028) and the Decade of Action on Nutrition (2016-2025) as opportunities to raise awareness about the valuable link between family farming, agroecology and sustainable development.

The Symposium underscored the need to recognize that scaling up agroecology is a key element to achieve the Sustainable Development Goals (SDGs), endorsed by the international community in September 2015. Goal 2 aims to ""end hunger, achieve food security and improved nutrition and promote sustainable agriculture.""

The Symposium brought together more than 700 participants with representatives from 72 governments, around 350 civil society and other non-governmental groups, and 6 UN organizations.

The Symposium Chair Braulio Ferreira de Souza Dias emphasized in his summary that ""Agroecology offers multiple benefits"" – including for increasing food security and resilience, boosting livelihoods and local economies, diversifying food production and diets, promoting health and nutrition, safeguarding natural resources, biodiversity and ecosystem functions, improving soil fertility and soil health, adapting to and mitigating climate change, and preserving local cultures and traditional knowledge systems.

""It is critical that legal and regulatory frameworks are implemented in a way that ensures transformative change towards sustainable agriculture and food systems based on agroecology, and respects, protects and fulfills farmers' rights and access to productive resources such as land, water and seeds.""

The Chair's Summary also drafts a way forward including a list of ""urgently needed"" commitments from stakeholders. Governments are called on to develop policy and legal frameworks to promote and support agroecology and sustainable food systems, and to remove ""perverse incentives"" for unsustainable agriculture.

The Summary calls on FAO to develop a detailed 10-year action plan for agroecology and to begin implementing the Scaling up Agroecology Initiative.

Consumers and citizens are urged to act as agents of change in the food system to promote responsible consumption. Donors are asked to increase long-term funding to agroecology, while academia and research organizations are encouraged to increase research on agroecology.

On the sidelines of the Symposium, the World Future Council (WFC) with FAO and IFOAM – Organics International kicked off a global contest for the visionary policies that create enabling environments for agroecology, the 2018 Future Policy Award. The winners will be recognized in a ceremony at FAO in Rome later in 2018.

The Future Policy Award 2018 is supported by the FAO, the World Future Council, IFOAM-Organics International with the assistance of Green Cross International, DO-IT - Dutch Organic International Trade and Sekem Group (Egypt).

Every year, the most visionary policies tackling humankind’s most pressing challenges are commended with the Future Policy Award (FPA), the only global award hitherto that recognises policies rather than people. The World Future Council has awarded this annual prize since 2010 in partnership with UN agencies.

“This year’s Future Policy Award will reveal proven solutions that make sustainable agriculture possible. The World Future Council is determined to further cooperate with FAO in order to identify and share the best policies for advancing agroecology in the interest of future generations. It is critical that we learn from the policies that are already making an impact,’’ says Alexandra Wandel, Director of the World Future Council.

“World Leaders and the UN General Assembly recognise the potential of agroecology to achieve healthy nutrition for all and to address social injustice, climate change and biodiversity loss”, notes Peggy Miars, World Board President of IFOAM – Organics International. “We see it happen in numerous countries where the policy framework gets it right. Let’s showcase and reward these innovative policies!” [IDN-InDepthNews - 06 April 2018]

Photo: ©FAO/Riccardo Gangale

IDN is the flagship agency of the International Press Syndicate

Facebook.com/IDN.GoingDeeper - twitter.com/InDepthNews","UN InsiderAgroecology Key Element to Zero Hunger and Food SecurityBy Jaya RamachandranROME (IDN) – More than enough food is produced in the world to feed everyone, yet 815 million people go hungry, according to FAO, the Food and Agriculture Organization of the United Nations.
Agroecology, they say, can help transition to sustainable food and agriculture systems that ensure food security and nutrition for all, provide social and economic equity and conserve biodiversity and the ecosystem services on which agriculture depends.
Family farmers must remain central to bringing agroecology to scale, FAO Director-General José Graziano da Silva stressed in his closing remarks to the Second International Agroecology Symposium from April 3-5 at FAO in Rome.
Governments are called on to develop policy and legal frameworks to promote and support agroecology and sustainable food systems, and to remove ""perverse incentives"" for unsustainable agriculture.
The World Future Council has awarded this annual prize since 2010 in partnership with UN agencies."
8,https://www.thenews.com.pk/print/305369-the-zero-hunger-challenge,"Tue, 17 Apr 2018 07:00:00 GMT",The News International,The zero-hunger challenge,"According to the latest estimate, there are still nearly half a billion people who either go hungry or are undernourished in the countries that fall within Asia and the Pacific. Some 490 million people do not obtain the daily nutrients that are required to lead a healthy and productive life.

The region made a considerable amount of progress during the 1990s and 2000s in dealing with the problems created by malnutrition and hunger. But in recent years, we have found that the fight against hunger has slowed down in recent years and, in some cases, its effects have been reversed.

This comes as bad news for all of us because various governments had pledged to wipe out hunger, in all its forms, by 2030. In other words, in little more than 12 years, no one should suffer from hunger and malnutrition. The reality is that we have 152 months (give or take) or around 4,560 days to achieve this task.

As an economist, I have done the math that can guide us in handling this issue. As per my own estimates, we must pull 107,456 people out of hunger every day in Asia and the Pacific. So, this means we need to help around 107,000 or more people on a daily basis for a long time until our target is met.

Of course, we must do this against the backdrop of limited natural resources; climate change; an aging populations; and urbanisation. Hunger must also be eradicated amid conflicts; natural disasters; and humanitarian crises.

The growing demand for protein-rich foods can be viewed as one factor that can help defeat hunger. But in some countries, this trend has led to obesity, which must be tackled simultaneously. After all, the challenge is to ensure that everyone has access to affordable, nutritious foods at all times.

But when you consider the alarming statistics and the challenges before us, the situation appears to be depressing. But no one is ready to throw in the towel. In fact, they are willing to do just the opposite. The good news is that governments across this region are acutely aware of these challenges and aren’t giving up at any cost. They have recently reaffirmed their pledge to go the extra mile and eradicate hunger in all its forms from their respective countries.

Last week, government ministers and senior officials from 40 countries across this region came together in Fiji to provide strategic direction and assign priorities for the FAO to tackle these issues. This was the first time in more than two decades that such an event – the Regional Conference for Asia and the Pacific (APRC) – had been convened in the Pacific.

The passion and intensity with which discussions were held and ideas were shared was particularly striking. There was a clear edge to the talks: the effects of climate change on food and agriculture were now being realised. While the delegates engaged in productive discussions, a category-3 cyclone battered the conference venue – as if to remind delegates of the urgency of the tasks at hand.

The countries called upon the FAO to further assist them in strengthening their sector-specific contributions and help them monitor progress toward meeting the 2030 Sustainable Development Goals (SDG). They also wanted further support to integrate agriculture into their national policies, strategies and programmes for climate change and disaster risk reduction management.

To meet these SDG goals, and as part of their nationally-determined contributions, countries have highlighted the need for improved and more resilient crops; more efficient irrigation; improved animal and fisheries management; enhanced fertilisers; low-emission rice; and sustainable forest management as suitable measures that ought to be implemented.

The FAO is supporting governments to scale-up climate action for food and agriculture under the 2030 Agenda by mobilising finance and expertise at the field level and advocating for a more prominent role for food and agriculture in the global climate change agenda.

But climate change is not the only cause for concern. The countries acknowledged that food systems need to be addressed to tackle the growing rates of obesity – especially in the Pacific, where it has reached epidemic proportions. A great deal of concern was also evident because the number of people suffering from hunger has once again been on the rise in some parts of Asia. This trend has emerged after decades of reductions in the continent.

Civil society organisations that participated in the Fiji conference reminded governments that decisions made in meetings like these must be inclusive. The result must be in everyone’s best interest – particularly the most disadvantaged and food-insecure groups in society.

Adapting agriculture to climate change; improving nutrition for all; and eradicating hunger in all its forms will require teamwork. This form of teamwork was evident at the APRC. The FAO and its member countries and partners can collectively score the winning goal – the zero hunger goal. We can do this within the allotted time because we know that it isn’t impossible.

The writer is the assistant director-general and regional representative at the Food and Agriculture Organization of the UN.","Of course, we must do this against the backdrop of limited natural resources; climate change; an aging populations; and urbanisation.
After all, the challenge is to ensure that everyone has access to affordable, nutritious foods at all times.
There was a clear edge to the talks: the effects of climate change on food and agriculture were now being realised.
But climate change is not the only cause for concern.
Adapting agriculture to climate change; improving nutrition for all; and eradicating hunger in all its forms will require teamwork."
9,https://www.theguardian.com/environment/2018/apr/17/uk-to-review-climate-target-raising-hopes-of-a-zero-emissions-pledge,"Tue, 17 Apr 2018 07:00:00 GMT",The Guardian,UK to review climate target raising hopes of a zero emissions pledge,"The UK is to review its long-term target to cut climate emissions as part of global efforts to curb rising temperatures, the government has announced.

The announcement by clean growth minister Claire Perry during the Commonwealth heads of government meeting (Chogm) raises the possibility the UK could implement a target to reduce emissions to “net zero” by 2050, tightening the existing goal to cut greenhouse gases by 80% by that date.

Such a target would require more stringent cuts to carbon in the short as well as long term, and a much faster transformation of key parts of the economy – including energy, transport, industry and housing – than has yet been contemplated. The government’s statutory advisers would be expected to set out key choices on how this could be achieved.

Under the global Paris agreement, countries have committed to curbing temperature rises to “well below” 2C above pre-industrial levels and to pursue efforts to keep them to 1.5C, to prevent dangerous climate change.

Such a move will require the world to cut greenhouse gas emissions to net zero in the second half of the century. The UK government pledged in 2016 to enshrine a zero target in law, but has not yet passed any legislation.

After a global scientific review of the impacts of, and action needed to keep to, a 1.5C rise is published this autumn, the UK’s climate advisers will be asked to review the country’s 2050 target, Perry said in a speech on Tuesday.

After the report, she said: “We will be seeking the advice of the UK’s independent advisers, the Committee on Climate Change, on the implications of the Paris agreement for the UK’s long-term emissions reduction targets.”

The committee recently suggested the UK would have to meet the net-zero target by 2045-50 in order to do its bit to ensure global temperature rises do not exceed 1.5C.

A temperature rise of 1.5C is seen by some countries, such as low lying islands at risk of rising sea levels, as the limit beyond which their very existence is threatened.

Laurence Tubiana, a key architect of the Paris agreement and chief executive of the European Climate Foundation, said: “For a safe climate we need all governments to aim for cutting pollution to net zero levels by 2050.

“This decision to review Britain’s long-term climate target sends a strong message to the EU and other big economies that London is committed to the Paris agreement, and now it’s time they too considered what more they can do.”

Ways of meeting the net-zero target could include investing in projects to grow trees and restore soils, to take up greater carbon dioxide from the atmosphere, as well as more controversial measures such as investing in emissions reduction projects overseas. Even with such methods, the UK is likely to have to bring forward targets on phasing out diesel and petrol engines, and expand renewable energy generation and, potentially, nuclear power.

Many actions under Conservative-led governments since 2010, however, have dismayed climate campaigners and may have to be reconsidered. These include the failure to insulate the UK’s draughty homes, limits on renewable energy, the scrapping of carbon capture and storage projects and tax breaks for fossil fuels.

John Sauven, executive director of Greenpeace UK, said the review was extremely important and could provide a “valuable lead” for other countries.

“The data shows that the challenges posed by emissions from transport – land, sea and air – and our reliance on gas for heating will have to be confronted as a matter of urgency.

“Fossil-fuel dependent cars and vans need to be removed from sale by 2030, a step-change in energy efficiency standards in our construction industry should be prioritised, and the government must accept that no new runway at Heathrow will fit inside our carbon budget,” he added.

The government’s announcement was welcomed by others at the Commonwealth summit, where climate change has been seen as one of the key issues under discussion. Nearly half of the Commonwealth nations are classed as “small island developing states”, which are the most vulnerable to climate change.

Frank Bainimarama, prime minister of Fiji, which currently holds the presidency of the UN’s climate forum, told the meeting: “I am encouraged by Britain’s undertaking to review its climate targets with a view to increasing ambition. The [targets] we all promised to make in the Paris agreement should be setting high standards for the rest of the world to follow. But just as importantly, we in the Commonwealth can show how cooperation based on trust can supply the finance, technology and skilled resources to deliver the necessary transformation in our economies.”","The UK is to review its long-term target to cut climate emissions as part of global efforts to curb rising temperatures, the government has announced.
Such a move will require the world to cut greenhouse gas emissions to net zero in the second half of the century.
The UK government pledged in 2016 to enshrine a zero target in law, but has not yet passed any legislation.
John Sauven, executive director of Greenpeace UK, said the review was extremely important and could provide a “valuable lead” for other countries.
The [targets] we all promised to make in the Paris agreement should be setting high standards for the rest of the world to follow."
