,Link,Date,Media,Title,Article,Summary
13,https://www.queerty.com/memers-zero-sympathy-sarah-huckabee-sanders-shes-kicked-restaurant-20180625,"Mon, 25 Jun 2018 07:00:00 GMT",Queerty,Memers have zero sympathy for Sarah Huckabee Sanders after she’s kicked out of a restaurant,"Memers have zero sympathy for Sarah Huckabee Sanders after she’s kicked out of a restaurant

You’ve likely heard by now that White House press secretary Sarah Huckabee Sanders was kicked out of a restaurant over the weekend because of her ties to the Trump administration.

Stephanie Wilkinson, co-owner of the Red Hen, a farm-to-table restaurant in Lexington, Virginia, told the Washington Post that several of her employees are gay and were not comfortable serving Sanders, who regularly defends Trump’s anti-LGBTQ policies, including his ban on transgender people in the military.

After news broke that Sanders was asked to leave the restaurant, Republicans were quick to criticize the business owners, accusing them of discrimination.

Even Donald Trump himself took aim at the restaurant:

The Red Hen Restaurant should focus more on cleaning its filthy canopies, doors and windows (badly needs a paint job) rather than refusing to serve a fine person like Sarah Huckabee Sanders. I always had a rule, if a restaurant is dirty on the outside, it is dirty on the inside! — Donald J. Trump (@realDonaldTrump) June 25, 2018

But Republican strategist Ana Navarro put it best when she tweeted:

Some who defend baker’s right to refuse service to gay couples, whine re ppl refusing service to a person who’s the face of a deceitful Administration. What’s good for the goose, is good for the Red Hen. Difference is, being gay is not a choice. Being an accomplice to Trump, is. — Ana Navarro (@ananavarro) June 24, 2018

Now check out some of the memes…

Repost @daphneposh #sarahhuckabeesanders A post shared by Danny 4 Bernie (@danny4bernie) on Jun 24, 2018 at 10:56pm PDT

#sarahhuckabeesanders A post shared by Chad Parenteau (@cparenteau1) on Jun 24, 2018 at 4:24pm PDT

Related: Memers come for Melania Trump and her tacky “I really don’t care, do u?” jacket","Memers have zero sympathy for Sarah Huckabee Sanders after she’s kicked out of a restaurantYou’ve likely heard by now that White House press secretary Sarah Huckabee Sanders was kicked out of a restaurant over the weekend because of her ties to the Trump administration.
After news broke that Sanders was asked to leave the restaurant, Republicans were quick to criticize the business owners, accusing them of discrimination.
Even Donald Trump himself took aim at the restaurant:The Red Hen Restaurant should focus more on cleaning its filthy canopies, doors and windows (badly needs a paint job) rather than refusing to serve a fine person like Sarah Huckabee Sanders.
I always had a rule, if a restaurant is dirty on the outside, it is dirty on the inside!
What’s good for the goose, is good for the Red Hen."
14,https://www.rappler.com/newsbreak/in-depth/zero-hunger-bill-4-years-in-the-making,"Thu, 26 Jul 2018 07:00:00 GMT",Rappler,The long wait to 'Zero Hunger',"“I think the hesitation is, ‘okay, if there’s a right to food, does that mean that government should be providing it?’” Gutierrez said.While the Right to Adequate Food Act promotes inter-agency cooperation on implementing certain provisions, this does not necessarily mean that the government must be the primary producer of food for the people. According to Gutierrez, what the bill wants to promote is for the government to begin and to aid the process. (READ: Zero Hunger: Holding gov't responsible)","“I think the hesitation is, ‘okay, if there’s a right to food, does that mean that government should be providing it?’” Gutierrez said.While the Right to Adequate Food Act promotes inter-agency cooperation on implementing certain provisions, this does not necessarily mean that the government must be the primary producer of food for the people.
According to Gutierrez, what the bill wants to promote is for the government to begin and to aid the process.
(READ: Zero Hunger: Holding gov't responsible)"
15,https://www.innovatorsmag.com/inspire-others-to-zero-hunger/,"Sat, 21 Jul 2018 07:00:00 GMT",Innovators Magazine,Inspire others to zero hunger,"Around 815 million people are starving today in a world struggling to cope with rapidly rising populations and dwindling natural resources.

The goal to zero hunger can only be achieved with a diverse and impactful pipeline of innovation; while a willingness to take action across all levels of society, along with human compassion, will also be needed.

Organisations like the Bayer Foundations are key to supporting the scalable solutions that can deliver a world without hunger. And we are delighted to have the Bayer Foundations as sponsors for the Food for Thought category at this year’s Global Game Changers (GGC) event in Glasgow. The cross-sector awards, from Innovators Magazine and Newsquest Media, rewards impact towards the UN Global Goals. We believe this type of recognition is not only important in itself, but that it can help inspire others to develop new products and services that effectively tackle hunger.

Apply by 2 August for a chance to win the Food for Thought title, or any of the 10 awards up for grabs at the event in Glasgow’s iconic Grand Central Hotel.","Around 815 million people are starving today in a world struggling to cope with rapidly rising populations and dwindling natural resources.
The goal to zero hunger can only be achieved with a diverse and impactful pipeline of innovation; while a willingness to take action across all levels of society, along with human compassion, will also be needed.
Organisations like the Bayer Foundations are key to supporting the scalable solutions that can deliver a world without hunger.
And we are delighted to have the Bayer Foundations as sponsors for the Food for Thought category at this year’s Global Game Changers (GGC) event in Glasgow.
We believe this type of recognition is not only important in itself, but that it can help inspire others to develop new products and services that effectively tackle hunger."
16,https://www.devdiscourse.com/article/agency-wire/50243-fao-and-unesco-boost-efforts-for-sdgs-especially-zero-hunger-and-education,"Thu, 05 Jul 2018 07:00:00 GMT",Devdiscourse,"FAO and UNESCO boost efforts for SDGs, especially zero hunger and education","The Food and Agriculture Organization of the United Nations (FAO) and the UN Educational, Scientific and Cultural Organization (UNESCO) have renewed their partnership to boost efforts to achieve the Sustainable Development Goals, including the goal of Zero Hunger. FAO Director-General Jose Graziano da Silva and UNESCO Director-General Audrey Azoulay today signed a new Memorandum of Understanding in Paris. It comes more than 70 years after the first partnership signed between the agencies.

""This new agreement opens a new chapter in the relationship between our two organizations,"" said FAO's Graziano da Silva. ""We need to work closely together to accelerate our efforts towards the goals set out under Agenda 2030.""

UNESCO Director-General Audrey Azoulay welcomed reinforced collaboration between UNESCO and FAO as two key Specialized Agencies of the UN system. ""The nexus between education, culture, food, and health is at the center of many of the challenges faced in this century"", she highlighted. ""We are committed to strengthening our collaboration in these areas to create sustainable futures for societies.""

Under the partnership, FAO and UNESCO have agreed to support the development of learning modules, teaching aids and practical sessions for agricultural secondary schools, universities and farmer field schools on food security and sustainable food systems. The agencies will also explore opportunities for nutrition education and healthy nutrition in schools.

This builds on the joint work already being carried out in South Sudan's cattle camps, where literacy and numeracy training by UNESCO is incorporated into FAO's Pastoral Field School approach. This means young people can access a formal school curriculum as well as topics on livestock management and livelihoods' diversification.

FAO and UNESCO will also develop a joint knowledge-sharing platform on the nexus between food, culture, and peace, and develop special education projects in poor, rural conflict-affected areas.

The two agencies in cooperation with international organizations, governments, and large youth organizations will develop a global platform for young people to become champions of the SDGs in their local communities, and an international award will honor outstanding contributions.

FAO will also continue work on the Globally Important Agricultural Heritage Systems, and build on the existing cooperation with UNESCO's World Heritage Systems.

The cooperation will also further explore synergies between UNESCO's 1972 World Heritage Convention and FAO's GIAHS in the field of sustainable fisheries, wildlife conservation and protected areas, climate change, and forests. The agencies will also work to identify elements of living heritage related to agricultural heritage systems and review measures to safeguard them at the national level.","The Food and Agriculture Organization of the United Nations (FAO) and the UN Educational, Scientific and Cultural Organization (UNESCO) have renewed their partnership to boost efforts to achieve the Sustainable Development Goals, including the goal of Zero Hunger.
FAO Director-General Jose Graziano da Silva and UNESCO Director-General Audrey Azoulay today signed a new Memorandum of Understanding in Paris.
UNESCO Director-General Audrey Azoulay welcomed reinforced collaboration between UNESCO and FAO as two key Specialized Agencies of the UN system.
FAO will also continue work on the Globally Important Agricultural Heritage Systems, and build on the existing cooperation with UNESCO's World Heritage Systems.
The agencies will also work to identify elements of living heritage related to agricultural heritage systems and review measures to safeguard them at the national level."
17,https://reliefweb.int/report/world/healthy-soils-are-essential-achieve-zero-hunger-peace-and-prosperity,"Mon, 13 Aug 2018 07:00:00 GMT",ReliefWeb,"Healthy soils are essential to achieve Zero Hunger, peace and prosperity - World","FAO Director-General urges countries to scale up soils' potential to help address climate change

13 August 2018, Rio de Janeiro - Improving the health of the world's soils is essential to achieve the Sustainable Development Goals, including Zero Hunger and combating climate change and its impacts, FAO Director-General José Graziano da Silva, today told participants of the World Congress of Soil Science.

In a video message to the event, which is being attended by more than 2,000 scientists from around the world, Graziano da Silva noted that approximately one third of the Earth's soil is degraded.

""Soil degradation affects food production, causing hunger and malnutrition, amplifying food-price volatility, forcing land abandonment and involuntary migration-leading millions into poverty,"" he said.

The FAO The Status of the World's Soil Resources report has identified 10 major threats to soil functions including soil erosion, soil nutrient imbalance, soil carbon and biodiversity losses, soil acidification, contamination, soil salinization, and soil compaction.

Graziano da Silva stressed the importance of sustainable soil management as an ""essential part of the Zero Hunger equation"" in a world where more than 815 million people are suffering from hunger and malnutrition.

Soils and climate change

""Although soils are hidden and frequently forgotten, we rely on them for our daily activities and for the future of the planet,"" the FAO Director-General said, underscoring the important role soils can play to support efforts by countries to mitigate or adapt to a changing climate.

In particular, he pointed to the potential of soils for carbon sequestration and storage, which has been documented in a global soil organic carbon map released by FAO. ""Maintaining and increasing soil carbon stock should become a priority,"" Graziano da Silva said.

He also noted how soils act as filters for contaminants, preventing their entry into the food chain and reaching water bodies such as rivers, lakes, seas and oceans, but that this potential is limited when contamination exceeds the capacity of soils to cope with pollution.

Global Soil Partnership

In his message, Graziano da Silva pointed to the Global Soil Partnership in which FAO works with governments and other partners to build technical capacity and exchange knowledge regarding sustainable soil management through the Voluntary Guidelines for Sustainable Soil Management.

""Let us make make soils a vehicle of prosperity and peace, and show the contribution of soils to achieve the Sustainable Development Goals,"" the FAO Director-General said.

Contact

Peter Mayer

FAO Media Relations (Rome)

(+39) 06 570 53304

peter.mayer@fao.org","In a video message to the event, which is being attended by more than 2,000 scientists from around the world, Graziano da Silva noted that approximately one third of the Earth's soil is degraded.
The FAO The Status of the World's Soil Resources report has identified 10 major threats to soil functions including soil erosion, soil nutrient imbalance, soil carbon and biodiversity losses, soil acidification, contamination, soil salinization, and soil compaction.
Graziano da Silva stressed the importance of sustainable soil management as an ""essential part of the Zero Hunger equation"" in a world where more than 815 million people are suffering from hunger and malnutrition.
""Maintaining and increasing soil carbon stock should become a priority,"" Graziano da Silva said.
""Let us make make soils a vehicle of prosperity and peace, and show the contribution of soils to achieve the Sustainable Development Goals,"" the FAO Director-General said."
18,https://reliefweb.int/report/world/leaving-no-one-behind-empowering-africas-rural-women-zero-hunger-and-shared-prosperity,"Thu, 27 Sep 2018 07:00:00 GMT",ReliefWeb,Leaving no one behind: Empowering Africa's rural women for Zero Hunger and shared prosperity - World,"African Union and FAO call for greater support to rural women as agents of change to end hunger

27 September 2018, New York - Gender gaps in agriculture in Africa are holding back progress towards ending hunger and must be urgently addressed, the UN Food and Agriculture Organization's Director-General José Graziano da Silva said at a joint event with the African Union (AU) on the margins of the UN General Assembly.

""We need to better recognize and harness the fundamental contribution of women to food security and nutrition. For that, we must close persisting gender gaps in agriculture in Africa,"" Graziano da Silva said.

The Director-General called for better representation of women in governance mechanisms and decision-making processes, as well as adequate and equal access to land, financial resources, social protection programmes, services and opportunities for women in rural areas.

Addressing gender gaps

The findings and recommendations of the AU-FAO study The Regional Outlook on Gender and Agrifood Systems were presented at the event. The Outlook is based on an extensive review of existing statistics, gender audits of 38 National Agricultural Investment Plans and in-depth country gender assessments carried out in 40 countries.

The study's recommendations call for a ""gender data revolution"" in the agri-food sector to inform sound policies and programmes, and elevating the gender benchmarks in planning, monitoring and accountability.

""We need to put in place gender targeted programmes that address women's specific vulnerabilities but also their key role in household nutrition and resilience,"" Graziano da Silva said.

""Evidence shows that when women are empowered, farms are more productive, natural resources are better managed, nutrition is improved, and livelihoods are more secure,"" he added.

The backbone of rural production

In some African countries, women account for up to 60 percent of the labour force in family farming. They are largely responsible for agricultural activities such as growing vegetables, preserving harvests and raising small ruminants such as sheep and goats. Women are also responsible for family nutrition through the preparation of meals.

Closing productivity gaps could increase food production and consumption by up to 10 percent and reduce poverty by up to 13 percent.

If women have the same access to skills, resources and opportunities as men, they can be powerful drivers in the fight against hunger, malnutrition and poverty. Empowering women in agriculture, value chains and trade will accelerate the achievement of the Malabo Commitments and the Sustainable Development Goals.

FAO and UN Women: building momentum on gender equality

On the sidelines of the event, FAO Deputy Director-General Maria Helena Semedo met with UN Women's Deputy Executive Director Asa Regner.

UN Women recently commended FAO for its achievements so far in gender equality. In 2017, FAO met or exceeded 93 percent of all performance indicators under the UN System-wide Action Plan on Gender Equality and the Empowerment of Women.

""FAO recognizes the importance of gender equality and women's empowerment - both within the Organization and in our work where gender is a major priority. We know that when women have decision-making power, all of society benefits,"" Semedo said.

""The partnership between UN Women and FAO has proven especially fruitful in turning words into concrete action. I look forward to continued, strengthened cooperation between the two agencies to unlock the potential of rural women and girls as agents of change,"" Regner said.

Equality in action

FAO and partners are providing technical support to many African countries in order to empower rural women. One example is the Joint Programme on Accelerating Progress towards the Economic Empowerment of Women in Ethiopia, Liberia, Niger and Rwanda, implemented with the World Food Programme, the International Fund for Agricultural Development and UN Women. The Programme has already enabled more than 40,000 women to receive training on improved agricultural technologies, and aims to enhance their access to financial services and markets.","""We need to better recognize and harness the fundamental contribution of women to food security and nutrition.
The backbone of rural productionIn some African countries, women account for up to 60 percent of the labour force in family farming.
Empowering women in agriculture, value chains and trade will accelerate the achievement of the Malabo Commitments and the Sustainable Development Goals.
I look forward to continued, strengthened cooperation between the two agencies to unlock the potential of rural women and girls as agents of change,"" Regner said.
Equality in actionFAO and partners are providing technical support to many African countries in order to empower rural women."
19,https://andestimes.com/campaign-for-zero-hunger-seeks-empowerment-of-indigenous-women/2005/,"Fri, 07 Sep 2018 07:00:00 GMT",Andes Times,Campaign for Zero Hunger seeks empowerment of indigenous women – Andes Times,"According to the United Nations, indigenous women have higher malnutrition rates than any other social group and typically earn a lot less than men, putting them at a serious disadvantage. Statistics published by Reuters also show that indigenous peoples, of which there are around 5000 different communities across the world, constitute 15% of those reportedly in a position of extreme hunger and poverty.

Speaking to the Mexico City Forum on Indigenous Women, FAO director-general Jose Graziano da Silva commented, “indigenous women face a triple discrimination – poverty, gender and ethnicity, both within and outside their communities – making them highly vulnerable.”

It is no surprise, therefore, that the UN Food and Agriculture organisation (FAO) argue that tackling malnutrition among female indigenous communities is a critically important aspect of solving the issue of world hunger.

For this reason, the UN is working with the International Forum of Indigenous Women and the News Agency for Indigenous and Afro-descendant Women in a global campaign entitled #IndigenousWomen Visible Women to highlight the discrimination they face around the world.

Yesterday, September 5, marked the celebration of Indigenous Women Day, which saw the FAO make another special call for 30 South American leaders to join the campaign for the empowerment of indigenous women.

This year’s celebration also marked the introduction of an initiative labelled ‘violet chair,’ an urgent call to encourage the participation of indigenous women in Zero Hunger policy discussions, behind the metaphor of a seat at the table.

“We cannot be short of food…corn… plantain… these are the foods that characterise our countries,” said Indira Vargas, a member of the Ecuadorian Quechua indigenous people, in a Visible Women campaign video.

“It is important to make indigenous women visible because it is a debt that states still owe indigenous towns and particularly indigenous women,” Salvadorian Betty Elisa Perez Valiente of the Nahuat Pipil community stated in an FAO campaign video.

In Mexico, advances in this area have already been made as July’s presidential election saw the first indigenous woman, traditional healer and Nahua speaker Maria de Jesus Patricio Martinez, run as a presidential candidate.","According to the United Nations, indigenous women have higher malnutrition rates than any other social group and typically earn a lot less than men, putting them at a serious disadvantage.
For this reason, the UN is working with the International Forum of Indigenous Women and the News Agency for Indigenous and Afro-descendant Women in a global campaign entitled #IndigenousWomen Visible Women to highlight the discrimination they face around the world.
Yesterday, September 5, marked the celebration of Indigenous Women Day, which saw the FAO make another special call for 30 South American leaders to join the campaign for the empowerment of indigenous women.
This year’s celebration also marked the introduction of an initiative labelled ‘violet chair,’ an urgent call to encourage the participation of indigenous women in Zero Hunger policy discussions, behind the metaphor of a seat at the table.
“It is important to make indigenous women visible because it is a debt that states still owe indigenous towns and particularly indigenous women,” Salvadorian Betty Elisa Perez Valiente of the Nahuat Pipil community stated in an FAO campaign video."
