,Link,Date,Media,Title,Article,Summary
48,https://www.latimes.com/world-nation/story/2020-10-23/la-fg-world-food-program-nobel-hunger,"Thu, 29 Oct 2020 07:00:00 GMT",Los Angeles Times,"The U.N.’s World Food Program, recipient of the Nobel Peace Prize, keeps focus on reaching zero global hunger","The U.N.'s World Food Program, this year’s recipient of the Nobel Peace Prize, puts the problem of global hunger bluntly: “690 million people still go to bed on an empty stomach each night.”

In a world where enough food is produced to feed all of its 7.8 billion inhabitants, the program contends that this issue shouldn’t exist.

Yet the organization’s officials estimate hundreds of millions of people are starving worldwide, which makes their goal to reach zero world hunger by 2030 seem extraordinarily ambitious.

The emergence of the coronavirus — which had killed more than 1.1 million people worldwide and infected more than 44 million as of Thursday — is expected to increase the number of people needing meals by many millions. Without an additional $5 billion in funding, said Steve Taravella, World Food Program senior spokesman, the program will fall short of the world’s needs during the next six months.

Advertisement

“Some people are likely to die simply because we cannot reach them in time,” Taravella said.

The World Food Program, which began in the early 1960s and serves more than 80 countries, relies mainly on international government contributions. Of about $8 billion in funds last year, $3.4 billion came from the U.S.

Here is more information about the World Food Program:

Background

Established in 1961, the World Food Program began as a three-year experiment to distribute food. It served as a global emergency responder and became a permanent part of the United Nations as natural disasters and conflict ensued.

Today, the program is the world’s largest humanitarian agency, with about 18,000 staffers spread around the world. It operates in some of the world’s most war-torn areas, such as Yemen and Syria. It also partners with other local and international organizations to chip away at underlying causes of hunger. It is funded by donations from individuals, corporations and governments, and is governed by an executive board of representatives from 36 countries who set goals, create policy and oversee its activities.

Chad, Liberia, Haiti, Rwanda, Madagascar and North Korea were the countries with the worst chronic hunger from 2017 to 2019, according to the United Nations. Several other countries may fall within that category but did not report their data.

Advertisement

Adapting to COVID-19

The program works with each country’s health protocols without using a top-down approach in pursuing its goal of providing food aid. Its 18,000 field workers collaborate with local officials to determine each community’s specific needs. In coping with the COVID-19 pandemic this year, that has generally meant following social distancing and other precautions advised by many health authorities.

“The basic principles of infection control are the same regardless of location — keeping distant from other people, washing hands frequently, wearing masks to prevent transmission, isolating from others if one has become infected,” Taravella said. “Many settings we work in make that more difficult, but the fundamentals are the same.”

During the pandemic, World Food Program teams, for example, have worked day and night to prepack food for more than a million refugees in northern Uganda, according to a video shared by the program’s Twitter account. Some workers filled empty sacks with a few potfuls of corn buds, while others poured maize oil into empty water bottles. Cups of salt were packaged into brown paper bags. This helped refugees get in and out quicker with their groceries.

Advertisement

There have also been efforts by communities facing severe food needs to help control the spread of the coronavirus. In the Cox’s Bazar refugee camp in Bangladesh, about 40 women began sewing masks for their community after their clothing business slowed down. The U.N. says these women are being paid for their work by the U.S. Agency for International Development.

Taravella said World Food Program workers are required to take their temperatures daily at the Cox’s Bazar refugee camp. If a fever is detected, workers self-isolate and medical officials provide further guidance. He said at least six workers — three in Yemen and one each stationed in Bangladesh, Sudan and the Dominican Republic — have died this year of COVID-19.

Program’s vision

The World Food Program has identified what it calls five steps to zero hunger:

Advertisement

Put the furthest behind first: “To realize the full potential of our globalized economy, national governments must expand social protection schemes for the most vulnerable.”

Pave the road from farm to market: “We must also improve rural infrastructure, particularly roads, storage and electrification, ensuring farmers’ ability to reach a wider consumer base.”



Reduce food waste: “In developed countries food is often wasted on the plate, while in developing countries it is lost during production, as crops go unused or unprocessed because of poor storage or because the farmers cannot get their goods to market.”

Encourage a sustainable variety of crops: “Today across the globe, four crops (rice, wheat, corn and soy) represent 60% of all calories consumed. Addressing the challenges of climate change, and food availability and food access, will require helping farmers explore and identify a more diverse range of crops.”

Make nutrition a priority, starting with a child’s first 1,000 days: “To prevent stunting and to promote healthy development, we must ensure that children and nursing mothers have access to the required nutritious foods.”



Caitlin Welsh, director of the Center for Strategic and International Studies’ Global Food Security Program, said inefficiencies will always afflict mammoth programs such as the World Food Program and noted it should be celebrated for undertaking a “huge challenge,” especially during the pandemic and economic recession.

“It’s the responsibility of local government to curb violence, to come together to address climate change,” Welsh said. “When we don’t see that happening, that’s when the World Food Program comes in.”","Yet the organization’s officials estimate hundreds of millions of people are starving worldwide, which makes their goal to reach zero world hunger by 2030 seem extraordinarily ambitious.
The World Food Program, which began in the early 1960s and serves more than 80 countries, relies mainly on international government contributions.
Here is more information about the World Food Program:BackgroundEstablished in 1961, the World Food Program began as a three-year experiment to distribute food.
Taravella said World Food Program workers are required to take their temperatures daily at the Cox’s Bazar refugee camp.
“When we don’t see that happening, that’s when the World Food Program comes in.”"
49,https://reliefweb.int/report/world/2020-global-hunger-index-one-decade-zero-hunger-linking-health-and-sustainable-food,"Mon, 12 Oct 2020 07:00:00 GMT",ReliefWeb,2020 Global Hunger Index: One decade to zero hunger linking health and sustainable food systems - World,"What do we know about the hunger situation worldwide? Has progress been made or are there any setbacks? Using the Global Hunger Index, the global hunger situation can be calculated and assessed.

The Global Hunger Index (GHI) is a tool designed to comprehensively measure and track hunger and undernutrition at global, regional, and national levels. It is designed to raise awareness and understanding of the fight against hunger, and call attention to those areas of the world where hunger levels are highest and where the need for additional efforts to eliminate hunger is greatest.

Global Hunger Index 2020: Progress and Setbacks

The 2020 GHI shows that while the world has made gradual progress in reducing hunger on a global scale since 2000, this progress has been too slow. Hunger persists in many countries, and in some instances, progress is even being reversed. The global level of hunger and undernutrition is at a moderate level. It has fallen from a GHI score of 29.0 points in 2000 to 18.2 points in 2020. While this is encouraging, hunger persists in many countries, and in some instances, progress is even being reversed.

Of the countries for which data relevant to all four GHI indicators are available, three countries – Chad, Timor-Leste, and Madagascar – suffer from a level of hunger that is alarming (the second highest level on the GHI scale). Based on other known data, alarming hunger levels have also been provisionally identified in another eight countries. Hunger is at serious levels in 31 countries and provisionally categorised as serious in another nine countries. For 14 countries in the moderate, serious or alarming categories, hunger and malnutrition has worsened since 2012 – driven by conflict, poverty, inequality, poor health, and climate change.

On a global level, the prevalence of undernourishment has stagnated since 2015, and the absolute number of people who are undernourished was nearly 690 million in 2020. These levels are greatest in countries in Africa South of the Sahara and South Asia. Even in some countries without hunger crises at the national level, marginalised groups and selected regions face tragically high levels of hunger and undernutrition.

While the 2020 GHI does not yet reflect the impacts of COVID-19, it shows that the situation is already worrying in many contexts and is likely to worsen in the years to come.

Failing Food Systems

The COVID-19 pandemic has highlighted the fragility of our globalised food systems, their inherent inequities, and their inadequacy to the task of achieving Zero Hunger. This year's report focuses on the threat to human, animal, and environmental health posed by these food systems.

Although the commitment to reach Zero Hunger by 2030 is a fundamental ambition of the Sustainable Development Goals, our hard-won gains are under threat or being reversed. The 2020 GHI shows that multiple countries have higher hunger levels now than in 2012, and approximately 37 countries are set to fail to achieve low levels of hunger by 2030. Additional countries, for which data were insufficient to calculate 2030 projections, may also fall short of this goal.

Achieving Zero Hunger Means Reshaping Food Systems

“The 2020 GHI findings highlight the food insecurity challenges facing low-income countries as they battle multiple crises,” write Robyn Alders, Osman Dar, Richard Kock, and Francesco Rampa of Chatham House.

The focus of their special essay for the 2020 GHI is on how to make our food systems more resilient to shocks and protect the most vulnerable using an integrated approach to health and food and nutrition security.

""At this crucial moment, we must act to reshape our food systems as fair, healthy, and environmentally friendly in order to address the current crises, prevent other health and food crises from occurring, and chart a path to Zero Hunger by 2030."" Robyn Alders, Osman Dar, Richard Kock, & Francesco Rampa Chatham House

Where are Hunger Levels the Worst?

This year’s GHI shows that many countries still require urgent attention.

Alarming levels of hunger exist in three countries, Chad, Timor-Leste, and Madagascar. Countries with incomplete data are provisionally categorised according to the GHI Severity Scale based on existing data and complementary reports.

According to this, alarming hunger has also been provisionally identified in another eight countries: Burundi, Central African Republic, Comoros, Democratic Republic of the Congo, Somalia, South Sudan, Syria, and Yemen.

Several of these countries are experiencing unrest or violent conflict, which affects the availability of data as well as the food and nutrition situation in the country. It is quite possible that one or more of these countries would have a higher GHI score than Chad – the country with the highest 2020 GHI score – if sufficient data were available.

It is crucial to strengthen data collection to gain a clearer picture of food and nutrition security in every country so that actions designed to eliminate hunger can be adapted to conditions on the ground.

How is the Global Hunger Index Calculated?

The countries analysed can be categorised according to whether their hunger level is extremely alarming, alarming, serious, moderate or low. The higher the value, the higher the severity of hunger in the country in question.

The 4 Indicators of the Global Hunger Index","Using the Global Hunger Index, the global hunger situation can be calculated and assessed.
The Global Hunger Index (GHI) is a tool designed to comprehensively measure and track hunger and undernutrition at global, regional, and national levels.
Global Hunger Index 2020: Progress and SetbacksThe 2020 GHI shows that while the world has made gradual progress in reducing hunger on a global scale since 2000, this progress has been too slow.
How is the Global Hunger Index Calculated?
The 4 Indicators of the Global Hunger Index"
50,https://www.thehindu.com/opinion/lead/the-road-to-zero-hunger-by-2030/article32865528.ece,"Fri, 16 Oct 2020 07:00:00 GMT",The Hindu,The road to zero hunger by 2030,"Resilient food systems will have to be built back as the world is not on track to achieve global targets

Food is the essence of life and the bedrock of our cultures and communities. It can be a powerful means to bring people together to grow, nourish and sustain the planet. The exceptional circumstances we have all been living in through 2020 underscores this — not only does COVID-19 pose a threat to food security and agricultural livelihoods, it compounds the threats already faced by 690 million people around the world. This World Food Day, we — the food agencies of the United Nations (UN) — pledge to work together to end hunger, eradicate food insecurity and achieve Sustainable Development Goal 2.

There is much to be done. While we can all be proud of the progress we have made — for instance, agricultural productivity has improved significantly in recent decades — yet sadly, more than two billion people globally still lack access to sufficient, nutritious and safe food. Projections show that the world is not on track to achieve zero hunger by 2030, or to meet global nutrition targets.

Also read | Fight against hunger disrupted by coronavirus-induced recession

India has gone from being a net importer to a net exporter of food grains. This strength has been evident through the pandemic. Central and State governments were able to distribute around 23 million tonnes from India’s large domestic food grain reserves in three months (April to June) through the Public Distribution System, providing much-needed emergency assistance to families around the country. The government also successfully mobilised food rations for 820 million people from April to November 2020, including finding alternate solutions to provide food rations to 90 million schoolchildren. Throughout the national lockdown imposed in March, there were efforts to remove bottlenecks in the food supply chain due to restrictions on movements, and to ensure that agricultural activities weren’t disrupted. Thanks to these measures, agriculture grew at 3.4% during the first quarter this financial year and the area cultivated this kharif exceeded 110 million hectares. This is a major achievement.

Malnutrition, anaemia

But the focus on food during the COVID-19 containment measures has also brought out the multi-dimensionality of India’s food challenges — not least those centred around malnutrition and climate change. Even as malnutrition in India has notably declined over the past decade, the Comprehensive National Nutrition Survey 2016-18 revealed that over 40 million children are chronically malnourished, and more than half of Indian women aged 15-49 years are anaemic. Initiatives such as the Integrated Child Development Services — which provides cooked meals and take-home rations to 100 million children under the age of six, as well as to pregnant and lactating mothers — and the mid-day meal programme, are however stellar examples of how the government is working to fix these challenges.

Climate change continues to be a real and potent threat to agrobiodiversity, which will impact everything from productivity to livelihoods across food and farm systems. Though India is dealing innovatively with climate change — for example, through the development of drought and flood tolerant seed varieties, weather-based agricultural advisories, promotion of millets, and small-scale irrigation — this year, we saw how climate-related shocks made it difficult for farmers to deal with pest and locust attacks, as well as floods and cyclones. Intensified food production systems with excessive use of chemicals and unsustainable farming practices cause soil degradation, fast depletion of groundwater table and rapid loss of agro-biodiversity. These challenges multiply with an increase in fragmentation of landholdings. In India, more than 86% farmers have less than two hectares of land contributing around 60% of the total food grain production and over half the country’s fruits and vegetables.

Essay | The global text of hunger

All this points to two undeniable imperatives: the way we produce food must change through agroecology and sustainable production practices in agriculture and allied sectors; and second, we must stop the waste — one-third of the food we produce is wasted. That is why the UN, and our three agencies — the FAO (The Food and Agriculture Organisation), IFAD (International Fund for Agricultural Development) and WFP (The World Food Programme) — are committed to working with government, civil society, farmers’ organisations and the private sector to build sustainable food systems.

Supporting India

During the COVID-19-precipitated lockdown, the FAO, IFAD and the WFP worked in close coordination to support the Government of India’s Empowered Group 5 on facilitating supply chain and logistics management, so necessary items such as food and medicines were available. The agencies provided daily updates on the real-time situation on the ground, collating challenges/red flags, dynamic anecdotal data and good practices from their sources in the field. This prompted swift action in terms of resolving bottlenecks and ensured progress on addressing red flag issues.

Profile | World Food Programme, leading the global fight against hunger

What is a food system? It is a framework that includes every aspect of feeding and nourishing people: from growing, harvesting and processing to packaging, transporting, marketing and consuming food. To be sustainable, a food system must provide enough nutritious food for all without compromising feeding future generations.

As countries begin to develop and implement COVID-19 recovery plans, it is also an opportunity to adopt innovative solutions based on scientific evidence so they can build back better and make food systems more resilient and sustainable. Today, with the FAO celebrating 75 years of fighting hunger in over 130 countries, IFAD becoming the first UN agency to receive a credit rating, and the WFP being awarded the Nobel Prize for Peace this year, we are more committed — and better prepared — than ever to together develop solutions with the government, civil society and private sector.

Comment | It’s about food, nutrition and livelihood security

Working in concert

That is why this World Food Day (October 16), we call for global solidarity to help all populations, and especially the most vulnerable, to recover from the crisis, and to make food systems more resilient and robust. Everybody — governments, the private sector, civil society and local communities — has a role to play in transforming our food systems so they can withstand increasing volatility and climate shocks, deliver affordable and sustainable healthy diets for all, and provide decent livelihoods for food chain workers. We must all work in concert to make sure that our food systems nourish a growing population and sustain the planet, together.

Tomio Shichiri is the FAO Representative in India; Rasha Omar is Country Director, IFAD India, and Bishow Parajuli is Representative and Country Director, WFP India. The views expressed are personal","This World Food Day, we — the food agencies of the United Nations (UN) — pledge to work together to end hunger, eradicate food insecurity and achieve Sustainable Development Goal 2.
Projections show that the world is not on track to achieve zero hunger by 2030, or to meet global nutrition targets.
Profile | World Food Programme, leading the global fight against hungerWhat is a food system?
We must all work in concert to make sure that our food systems nourish a growing population and sustain the planet, together.
Tomio Shichiri is the FAO Representative in India; Rasha Omar is Country Director, IFAD India, and Bishow Parajuli is Representative and Country Director, WFP India."
