,Link,Date,Media,Title,Article,Summary
23,https://sdg.iisd.org/news/155-companies-urge-governments-to-enact-net-zero-emissions-recovery-from-covid-19/,"Tue, 26 May 2020 07:00:00 GMT",IISD Reporting Services,155 Companies Urge Governments to Enact Net Zero Emissions Recovery from COVID-19,"A group of 155 companies representing a combined market capitalization of USD 2.4 trillion have signed a statement urging governments to align their COVID-19 economic aid and recovery efforts with the latest climate science.

The companies, which are all members of the Science Based Targets initiative (SBTi), employ 5 million people, are headquartered in 33 countries, and span 34 sectors. Their statement calls on governments to build resilience against future shocks by aligning policies with the goal of limiting the global temperature increase to 1.5°C by achieving net zero emissions well before 2050. The companies pledge to continue to: demonstrate that the best decisions and actions are grounded in science; invest in recovery and resilience for a systemic socioeconomic transformation; and work with governments and scale up the movement.

Signatories include AstraZeneca, Bayer, Coca-Cola European Partners, Colgate Palmolive Company, EDF Group, EDP Energias de Portugal, Enel, Hewlett Packard Enterprise, Iberdrola, Inter IKEA Group, Intuit, JLL, Mars, Nestlé, Orange, PensionDanmark, Salesforce.com inc, and Unilever, among others.

A net zero-aligned recovery will enable companies to invest and innovate at the pace and scale necessary to build back better.

As members of the SBTi, the companies all have established, or pledged to establish, science-based emissions targets. In joining the statement, the companies reaffirm their own commitments to achieving a zero-carbon economy, and urge governments to match their ambition by “aligning policies and recovery plans with the latest climate science.”

The statement comes at a time when governments across the world are mobilizing trillions of dollars in economic stimulus packages to address the economic impact of the COVID-19 pandemic. Governments are also preparing to submit enhanced nationally determined contributions (NDCs) under the Paris Agreement on climate change this year.

The statement was organized by the SBTi, and its campaign partners with Business Ambition for 1.5°, the UN Global Compact, and the We Mean Business coalition. The SBTi independently assesses and validates corporate climate targets against climate science and is a collaboration between CDP, the UN Global Compact, the World Resources Institute (WRI), and the World Wildlife Fund (WWF).

UN Secretary-General António Guterres welcomed “the ambitious, science-based actions we are seeing from leading companies who are demonstrating to policymakers that green growth remains the best growth strategy.” “A net zero-aligned recovery will enable companies to invest and innovate at the pace and scale necessary to build back better, creating decent jobs, protecting health, reducing emissions and increasing resilience in the future,” said Maria Mendiluce, CEO, We Mean Business. [UN Gloabal Compact Statement] [UNFCCC Press Release]

By Gabriel Gordon-Harper, Thematic Expert on Climate Change and Sustainable Energy","A group of 155 companies representing a combined market capitalization of USD 2.4 trillion have signed a statement urging governments to align their COVID-19 economic aid and recovery efforts with the latest climate science.
The companies, which are all members of the Science Based Targets initiative (SBTi), employ 5 million people, are headquartered in 33 countries, and span 34 sectors.
A net zero-aligned recovery will enable companies to invest and innovate at the pace and scale necessary to build back better.
As members of the SBTi, the companies all have established, or pledged to establish, science-based emissions targets.
Governments are also preparing to submit enhanced nationally determined contributions (NDCs) under the Paris Agreement on climate change this year."
24,https://www.climatechangenews.com/2020/05/15/watchdog-germany-must-reach-net-zero-emissions-2038/,"Fri, 15 May 2020 07:00:00 GMT",Climate Home,Watchdog: Germany must reach net zero emissions by 2038,"An independent advisory body on environmental policy warned Germany risks exhausting its carbon budget by 2029 without robust climate action

By Florence Schulz for Euractiv

Germany must become carbon neutral by 2038 to avoid overshooting its carbon budget to limit global temperature rise below 2C, researchers at the independent Advisory Council on the Environment (SRU) have said.

Every four years, the SRU presents a comprehensive report on the state of the country’s environment and has been doing so for almost 50 years.

On Thursday, it did it again: on almost 560 pages, the seven climate researchers of the SRU have done an all-round job which doesn’t paint a particularly good picture for Germany.

Germany is not on track with 20 of the 25 environmental goals of its own sustainability strategy, according to the report. And binding targets on water protection, air quality and climate protection are regularly missed.

“So far, the failures are too often simply accepted and targets are postponed into the future,” the researchers noted.

Germany’s environment minister Svenja Schulze (SPD) seemed open to criticism. In a video message, she said the growing warnings by environmental researchers for the past 30 years risked becoming an “oppressive ritual”.

Climate news in your inbox? Sign up here

SRU researchers have sounded the alarm with very concrete figures.

Germany is allowed to emit 6.7 billion tonnes of CO2 from 2020 if global warming of 1.75C is taken as the target, which researchers consider to be the highest possible target to stay below 2C.

But if business as usual continues, this limit would already be reached in 2029. Consequently, if emissions were to be reduced linearly, Germany would have to be climate-neutral by 2038 at the latest, they argue.

“We will only achieve this if very, very strong reductions take place from 2030 at the latest,” said climate researcher Wolfgang Lucht.

The warnings of the Advisory Council echo similar messages by climate activist Greta Thunberg. Speaking to EU environment ministers in March, the teen activist warned about the rapidly declining amount of carbon dioxide that world nations are still allowed to emit before the rise in global temperatures risks hitting dangerous levels.

However, not all politicians are ready to consider carbon budget calculations.

In a statement yesterday, the head of the conservative alliance CDU/CSU parliamentary group, Georg Nüßlein, said that “the path to greenhouse gas neutrality must not, however, be lost in the small-scale climate budget”.

Instead, he called for more market-based tools and competition, including an expanded European emissions trading system, to achieve climate goals.

Nüßlein also denounced the connections environmentalists have made between the climate crisis and the coronavirus pandemic, saying it testified of a “fear among some climate experts that [the climate debate] would no longer be featured in the media”.

The CDU/CSU faction led by Nüßlein has recently published a controversial position paper in which he supports the European Commission’s Green Deal, but clearly rejects increasing the 2030 climate targets to 55% of emission reduction by 2030, up from 40% now.

In the report by independent advisors, criticism has also been levelled against the Germans’ favourite means of transport, the car.

“After the corona crisis, we must think carefully about what we promote. Every car with an internal combustion engine will continue to drive around and emit pollutants for at least another ten years,” said the advisory council’s chairwoman Claudia Hornberg.

In order to make driving in cities less attractive, expensive parking fees and a nationwide uniform road toll should be introduced, while environmentally friendly transport modes should be promoted, the researchers argued.

But not all advisors agreed. Building physicist Lamia Messari-Becker said there were need for a blanket demand for less car traffic but supported the introduction of CO2 emissions trading in the transport sector, as the German climate protection law already provides for from 2021.

The German climate experts also looked to Brussels to drive further climate action.

The European Green Deal is a “very good initiative”, but big promises are not enough, warned Christian Calliess, a professor of environmental law and a member of the advisory council.

“Ambitious programmes are adopted, but when it comes to concrete implementation, they are often missed,” he added.

Calliess called for the consistent integration of climate targets into all areas of EU policy, especially in the critical sectors of agriculture, transport and fisheries. Otherwise, he warned, biodiversity could reach an irreversible tipping point.

He suggested that all EU initiatives should be subjected to a sustainability check, adding European economic policy coordination could also help in this respect. The European Economic and Social Committee (EESC), for example, could carry out this screening, he suggested.

According to Calliess, however, some leeway must be offered to EU member states. “The EU must not always lose itself in the minutiae,” he said.

Above all, the EU should formulate minimum standards, because one cannot “put a European corset on everything,” Calliess said. EU member states must find their own regional solutions to the climate crisis, he added.

This story is an extract of a piece originally published by our media partner Euractiv.","On Thursday, it did it again: on almost 560 pages, the seven climate researchers of the SRU have done an all-round job which doesn’t paint a particularly good picture for Germany.
Germany is not on track with 20 of the 25 environmental goals of its own sustainability strategy, according to the report.
In a video message, she said the growing warnings by environmental researchers for the past 30 years risked becoming an “oppressive ritual”.
Consequently, if emissions were to be reduced linearly, Germany would have to be climate-neutral by 2038 at the latest, they argue.
Instead, he called for more market-based tools and competition, including an expanded European emissions trading system, to achieve climate goals."
25,http://sdg.iisd.org/news/zero-draft-of-hlpf-declaration-includes-call-for-sustainable-inclusive-growth/,"Tue, 02 Jun 2020 07:00:00 GMT",IISD Reporting Services,"Zero Draft of HLPF Declaration Calls for Sustainable, Inclusive Growth","The Ministerial Declaration to be adopted at the 2020 session of the UN High-level Political Forum on Sustainable Development (HLPF) has been released in zero draft form. Negotiations on the text will continue in June 2020 with a series of virtual informal consultations.

The co-facilitators for negotiations on the Ministerial Declaration, Georgi Velikov Panayotov, Permanent Representative of Bulgaria, and Amal Mudallali, Permanent Representative of Lebanon, held a virtual informal meeting on 4 May and then collected delegations’ written inputs.

The Declaration would commit to accelerating action to achieve the 2020 targets and requesting them to be updated for 2030.

The zero draft of the declaration includes a section on ‘Assessment of the situation regarding the 2030 Agenda,’ which highlights uneven progress in implementation of the 2030 Agenda, with some areas stalled or reversed (hunger, climate change, inequality) – as reported in the annual SDG Progress Report released by the UN Secretary-General on 14 May.

The draft also acknowledges the effects of the COVID-19 pandemic, asserting that “insufficient efforts” to implement the SDGs have exacerbated the pandemic’s impacts (overwhelming health systems, affecting the livelihoods of half the global workforce, disrupting supply chains, and closing schools, while also expected to push tens of millions of people back into extreme poverty and hunger).

The majority of the draft is a section listing ‘Actions to be taken for the way forward.’ Responses to and recovery from the pandemic are woven throughout the text. Among the actions to which Member States would commit, they note that governments:

“Will relaunch sustainable and inclusive growth,” reduce income inequalities and address developing countries’ financing challenges. To this end, “our economies will be reconfigured to protect the environment and create conditions for decent work for all” and support micro, small and medium-sized enterprises (MSMEs) to help restore jobs and incomes.

Will integrate a gender perspective into emergency social and economic schemes, noting the disproportionate impacts of COVID-19 on women, “who also face increased risks of domestic violence and exploitation.”

Pledge to increase their level of ambition to mobilize and effectively use all available means of implementation, in line with the Addis Ababa Action Agenda (AAAA) on Financing for Development (FfD), and to fully implement the agreed conclusions and recommendations of the 2020 ECOSOC FfD Forum. They also express deep concern about high debt levels as countries attempt to withstand COVID-19 and implement the 2030 Agenda.

Commit to “maintaining the integrity of the 2030 Agenda,” referring to the SDG targets with a 2020 deadline, including by: ensuring ambitious and continuous action on those targets, accelerating efforts to achieve them, and requesting intergovernmental fora and bodies to review and update them “to reflect a suitable level of ambition for 2030.”

Urge the UN to make better use of the Voluntary National Reviews presented each year during the HLPF by national governments, to support accelerated SDG achievement and encourage peer learning.

The text ends with a commitment to “invest more in human capital, to empower children, adolescents and youth, as critical agents of change, and support their meaningful participation in realizing the vision of the 2030 Agenda.”

Delegations will hold their next informal consultation on 8 June. Each of the Major Groups and other Stakeholders can nominate one representative to participate in the meeting and submit a written statement. Three representatives will be invited to make statements. The consultation will not be webcasted.

Additional informal consultations will convene on 16 June and 23 June, and the co-facilitators then plan to finalize agreement on the draft using the silence procedure.

The 2020 HLPF takes place from 7-16 July. The format is expected to be virtual, although some small, in-person meetings of New York-based participants reportedly have been considered. Registered participants will be able to attend the virtual meetings, while others can follow the meeting through the UN webcast or YouTube. Side events and exhibitions will take place only virtually.

The latest programme for the HLPF was released on 14 May, indicating that the Voluntary National Reviews will proceed on 10 July and from 13-16 July. The presenters include one country making its third VNR, 26 countries making their first VNRs, and 20 making their second-time presentations. (Since our previous update on VNR countries, Zimbabwe no longer appears on the list of second-time presenters). [Co-facilitators’ letter to Member States on 8 May] [SDG Knowledge Hub sources]","The Ministerial Declaration to be adopted at the 2020 session of the UN High-level Political Forum on Sustainable Development (HLPF) has been released in zero draft form.
Negotiations on the text will continue in June 2020 with a series of virtual informal consultations.
The Declaration would commit to accelerating action to achieve the 2020 targets and requesting them to be updated for 2030.
They also express deep concern about high debt levels as countries attempt to withstand COVID-19 and implement the 2030 Agenda.
The 2020 HLPF takes place from 7-16 July."
26,https://sdg.iisd.org/news/cities-regions-businesses-commit-to-race-to-zero-emissions-in-post-covid-19-economic-recovery/,"Thu, 11 Jun 2020 07:00:00 GMT",IISD Reporting Services,"Cities, Regions, Businesses Commit to “Race to Zero” Emissions in Post-COVID-19 Economic Recovery","A group of stakeholders has launched an initiative that aims to bring businesses, investors, cities, and regions on board to commit to reaching net zero emissions by 2050 and to accelerate climate action in light of the COVID-19 pandemic.

The ‘Race to Zero’ campaign, launched during a virtual event on 5 June 2020, on World Environment Day, aims to mobilize leadership and support for a healthy, resilient, zero-carbon economic recovery that creates well-paying jobs and inclusive, sustainable growth and prevents future threats.

The campaign is led by the UNFCCC Champions for Climate Action, Gonzalo Muñoz (Chile) and Nigel Topping (UK), and brings together a coalition of net zero emissions initiatives, covering 992 businesses, 449 cities, 21 regions, 505 universities, and 38 investors. These “real economy actors” join the 120 countries that are members of the Climate Ambition Alliance, a coalition of States committed to net zero emissions by 2050, representing over half of global gross domestic product (GDP) and covering nearly a quarter of carbon dioxide (CO2) emissions.

The launch event touched on, among others: COVID-19, climate change, and the public health case for a resilient, inclusive, zero-carbon economy; new announcements, data, and plans to drive sector-level transformation; and zero carbon as the new growth and leadership agenda for cities, finance, and “real economy pioneers.”

The transition to net zero is creating the greatest commercial opportunity of our time.

According to a UNFCCC press release, prioritizing climate change and low-carbon stimulus can spur economic recovery from COVID-19 and job creation as effectively as, or better than, environmentally neutral or harmful programmes. The ‘Race to Zero’ campaign will identify the most effective pathways to zero emissions in such sectors as energy, transport, industry, food, retail, and finance.

Speaking during the campaign launch, Alok Sharma, President of the 26th session of the Conference of the Parties (COP 26) to the UNFCCC and UK Secretary of State for Business, Energy and Industrial Strategy, expressed hope that COP 26 “can be a moment where the world unites behind a fairer, greener recovery from the effects of COVID-19.” COP 25 President Carolina Schmidt said that despite the health crisis, climate action must continue at all levels.

UNFCCC Executive Secretary Patricia Espinosa said the initiative must help spur enhanced nationally determined contributions (NDCs). Maria Neira, Director of Environment, Climate Change and Health, World Health Organization (WHO), called on governments to put health and climate action at the center of recovery plans.

UN Special Envoy for Climate and Finance and adviser to the UK Government on COP 26, Mark Carney, highlighted “the greatest commercial opportunity of our time” created by transitioning to net zero. Citing the COP 26 Private Finance Agenda, he said the COP 26 Presidency and the ‘Race to Zero’ campaign will focus on reorienting investment and finance towards net zero.

From the private sector, Mark Schneider, Nestle, said building a more sustainable food system will be central to addressing climate change. Warren East, Rolls Royce, expressed confidence that engineers can help break the airline industry’s reliance on fossil fuels, and supported a gradual transition towards green technology.

The virtual launch event convened as part of the UNFCCC’s June Momentum for Climate Change. The campaign will run up to COP 26, which was postponed due to the COVID-19 pandemic and will now convene from 1-12 November 2021. [UNFCCC Press Release] [Link to Race to Zero Launch Announcement] [ENB coverage of June Momentum for Climate Change]","The ‘Race to Zero’ campaign will identify the most effective pathways to zero emissions in such sectors as energy, transport, industry, food, retail, and finance.
Maria Neira, Director of Environment, Climate Change and Health, World Health Organization (WHO), called on governments to put health and climate action at the center of recovery plans.
Citing the COP 26 Private Finance Agenda, he said the COP 26 Presidency and the ‘Race to Zero’ campaign will focus on reorienting investment and finance towards net zero.
From the private sector, Mark Schneider, Nestle, said building a more sustainable food system will be central to addressing climate change.
[UNFCCC Press Release] [Link to Race to Zero Launch Announcement] [ENB coverage of June Momentum for Climate Change]"
