,Link,Date,Media,Title,Article,Summary
0,https://www.financialexpress.com/economy/hungry-india-only-seven-states-manage-to-address-uns-zero-hunger-goal-rest-fail/1812923/,"Sat, 04 Jan 2020 08:00:00 GMT",The Financial Express,Hungry India: Only seven states manage to address UN’s zero hunger goal; rest fail,"More than one in every three children aged below five is stunted in India and 40% of children aged between 6-59 months are anaemic.

India has performed dismally on UN’s Sustainable Development Goals with only seven Indian states successfully addressing “hunger and malnutrition”. The worst performers in the zero hunger goal were Bihar, Madhya Pradesh and Jharkhand. Overall, India performed worse than last year with its score falling from 2018’s 48 to 38 in 2019, according to NITI Aayog’s report on Sustainable Development Goals 2019. The same is in line with the findings of Global Hunger Index 2019 which was released in October 2019. The SDG 2019 report also highlights special attention is needed towards achieving zero hunger goal. “Two goals — 2 (zero hunger) and 5 (gender equality) demand special attention, as the overall country score is below 50,” the report said.

Also Read: Who’s feeding India’s children? Companies, people give 30 times more money to Akshaya Patra than govt

Despite India’s agricultural produce going up by six times in the last 70 years, food loss and wastage keep millions hungry. More than one in every three children aged below five is stunted in India and 40% of children aged between 6-59 months are anaemic. “It is important to emphasise that hunger is a problem not because there is not enough food for everyone… Food wastage and loss remain a major concern… Globally nearly 40% of the fruits and vegetables, and 30% of cereals that are produced are lost,” the report said.

However, some states and Union Territories have performed well in achieving the goal. “Goa and Chandigarh are the top-performing among States and UTs, respectively. Seven states and two UTs bagged a position in the category of Front Runners (with Index score higher than/equal to 65),” the report said. Besides Goa and Kerala, these states include mostly north-eastern states — Mizoram, Nagaland, Manipur, Arunachal Pradesh and Sikkim.

Talking about India’s hunger issue, Chanchalapathi Dasa, Vice-chairman, Akshaya Patra, had earlier told Financial Express Online that the government needs to infuse more money in child nutrition to combat hunger. Akshaya Patra Foundation works with the government for Poshan Abhiyan or Child Nutrition program.","More than one in every three children aged below five is stunted in India and 40% of children aged between 6-59 months are anaemic.
India has performed dismally on UN’s Sustainable Development Goals with only seven Indian states successfully addressing “hunger and malnutrition”.
The worst performers in the zero hunger goal were Bihar, Madhya Pradesh and Jharkhand.
The SDG 2019 report also highlights special attention is needed towards achieving zero hunger goal.
More than one in every three children aged below five is stunted in India and 40% of children aged between 6-59 months are anaemic."
1,https://reliefweb.int/report/zambia/zambia-zero-hunger-strategic-review-2018,"Tue, 07 Jan 2020 08:00:00 GMT",ReliefWeb,Zambia Zero Hunger Strategic Review 2018 - Zambia,"Executive Summary

INTRODUCTION

Achieving Zero Hunger is central to the 2030 Sustainable Development Agenda, to which Zambia is a signatory.

Sustainable Development Goal 2 (SDG 2) calls on the Member States of the United Nations to end hunger, achieve food security and improved nutrition and promote sustainable agriculture. In particular, SDG 2 aims to end hunger and ensure all people have access to safe, nutritious and sufficient food all year round; end all forms of malnutrition; double the agricultural productivity and incomes of smallholders; maintain the genetic diversity of seeds; increase investment in rural infrastructure, agricultural research and extension services, and technology development; correct and prevent trade restrictions and distortions in agricultural markets; and promote functional food markets in order to control food price volatility.1

The Zero Hunger Challenge is a mechanism that allows countries to systematically articulate how they plan to achieve SDG 2 by 2030. It identifies five key areas or pillars, which countries must achieve in order to effectively end hunger and malnutrition. These pillars include ensuring 100% access to adequate food all year round; zero stunted children under the age of two; all food systems are sustainable; 100% increase in smallholder productivity and income, and zero loss or waste of food.

The Government of the Republic of Zambia (GRZ) is committed to achieving the 2030 Agenda for Sustainable Development and to reporting on progress towards the SDG 2 goals and targets. These global goals and targets are consistent with the African Union’s commitment to eliminate hunger and food insecurity by 2063, and Zambia’s priorities in the Seventh National Development Plan (7NDP). The 7NDP lays out national strategies to address food and nutrition challenges in the first development outcomes under economic diversification and human development. These strategies are consistent with the five pillars of the Zero Hunger Challenge and are pertinent to ending hunger and malnutrition by 2030. The Zambia Zero Hunger Challenge is thus effectively anchored at the highest political level in the Country.

The GRZ commissioned the Zero Hunger Strategic Review (ZHSR) to lay out in a comprehensive manner the status, trends, responses and gaps in the five pillars of the Zero Hunger Challenge. The review recommends actions needed to achieve SDG 2 by 2030.

OBJECTIVES

The review provides a situational analysis of food and nutrition security in Zambia to contextualise the challenges and opportunities of achieving Zero Hunger by 2030. Based on this overview, a number of priority actions and milestones are recommended as the basis of a Road Map to Zero Hunger. This provides clarity on the specific roles that the private sector, civil society, and other non-governmental stakeholders would play in helping Zambia achieve Zero Hunger by 2030. The proposed strategic objectives and initiatives will strengthen Government efforts in ensuring the country achieves the food and nutrition security outcomes of the Seventh National Development Plan. The specific objectives of the review are as follows:","Executive SummaryINTRODUCTIONAchieving Zero Hunger is central to the 2030 Sustainable Development Agenda, to which Zambia is a signatory.
The Zambia Zero Hunger Challenge is thus effectively anchored at the highest political level in the Country.
The GRZ commissioned the Zero Hunger Strategic Review (ZHSR) to lay out in a comprehensive manner the status, trends, responses and gaps in the five pillars of the Zero Hunger Challenge.
Based on this overview, a number of priority actions and milestones are recommended as the basis of a Road Map to Zero Hunger.
This provides clarity on the specific roles that the private sector, civil society, and other non-governmental stakeholders would play in helping Zambia achieve Zero Hunger by 2030."
2,https://reliefweb.int/report/eswatini/eswatini-zero-hunger-strategic-review-december-2018,"Mon, 06 Jan 2020 08:00:00 GMT",ReliefWeb,"Eswatini Zero Hunger Strategic Review, December 2018 - Eswatini","EXECUTIVE SUMMARY

1.0 Introduction

The Government of Eswatini has endorsed and domesticated the Sustainable Development Agenda 2030 and further prioritized SDG 2 in an effort to end hunger among its citizens in line with the Global Zero Hunger Challenge. This challenge calls for member states to end hunger, achieve food security & improve nutrition and promote sustainable agriculture. In this regard the country working with key sectors undertook the Eswatini Zero Hunger Strategic Review (EZHSR) in an effort to inform implementation of SDGs 1 and 2. Achieving Zero Hunger is a priority that is articulated in national development frameworks, in particular the Strategy for Sustainable Development & Inclusive Growth (SSDIG) - and other sectoral policies and programmes including the Eswatini National Agricultural Investment Plan (ENAIP).

The Review seeks to analyse the obtaining food and nutrition situation and its linkages to poverty in the country and identify opportunities to strengthen current and future programmes and strategies aimed towards the attainment of zero hunger and ending poverty by 2030. The specific objectives of the review are:

❖ Provide a comprehensive understanding of the poverty, food security and nutrition context for Eswatini, including strategies, policies, programmes, institutional capacities and resource flows;

❖ Highlight previous progress and identify challenges Eswatini must overcome to achieve zero hunger by 2030 in line with the targets of SDG 2;

❖ Identify and prioritise policy and programme actions that are necessary to accelerate progress towards zero hunger, and recommend how these actions may be implemented.","EXECUTIVE SUMMARY1.0 IntroductionThe Government of Eswatini has endorsed and domesticated the Sustainable Development Agenda 2030 and further prioritized SDG 2 in an effort to end hunger among its citizens in line with the Global Zero Hunger Challenge.
This challenge calls for member states to end hunger, achieve food security & improve nutrition and promote sustainable agriculture.
In this regard the country working with key sectors undertook the Eswatini Zero Hunger Strategic Review (EZHSR) in an effort to inform implementation of SDGs 1 and 2.
Achieving Zero Hunger is a priority that is articulated in national development frameworks, in particular the Strategy for Sustainable Development & Inclusive Growth (SSDIG) - and other sectoral policies and programmes including the Eswatini National Agricultural Investment Plan (ENAIP).
The Review seeks to analyse the obtaining food and nutrition situation and its linkages to poverty in the country and identify opportunities to strengthen current and future programmes and strategies aimed towards the attainment of zero hunger and ending poverty by 2030."
3,https://www.pna.gov.ph/articles/1091024,"Thu, 16 Jan 2020 08:00:00 GMT",pna.gov.ph,Duterte creates task force on ‘zero hunger’,"President Rodrigo Duterte. (Presidential Photo)

MANILA -- To free more Filipinos from hunger and achieve food security, President Rodrigo Duterte has created an inter-agency task force on zero hunger.

Duterte signed Executive Order 101 on January 10 creating an inter-agency task force on zero hunger which will be chaired by Cabinet Secretary Karlo Nograles.

Serving as his vice-chairperson is Social Welfare Secretary Joselito Bautista.

Members of the task force include the Agriculture Secretary, Agrarian Reform Secretary, Budget Secretary, Education Secretary, Environment Secretary, Health Secretary, Labor Secretary, Interior Secretary, Trade Secretary, Science Secretary, Communications Secretary, National Economic and Development Authority Director-General, and the Commission on Higher Education Chairperson.

In the EO, Duterte recognized that involuntary hunger, food security, undernutrition, and child wasting, stunting and mortality, continue to be serious concerns in the country.

“There is a need to carefully coordinate, rationalize, monitor and assess the efforts of concerned government agencies and instrumentalities to ensure a whole-of-government approach to eradicating hunger and achieving food security,” Duterte said.

The task force will be assigned to formulate a National Food Policy (NFP), which will outline national priorities based on a comprehensive understanding of the problem of hunger and related issues, and will provide a roadmap for achieving zero hunger, taking into consideration existing laws and issuances, as well as international law and treaty obligations.

Under the NFP, initiatives for ending hunger, achieving food security, improving nutrition, and promoting sustainable agriculture will be identified.

It will coordinate and rationalize the efforts of concerned government agencies and instrumentalities to ensure a “whole-of-government” approach to attaining zero hunger and at the same time evaluate, through the identification of key performance indicators, the government's progress in ending hunger, achieving food security, improving nutrition, and promoting sustainable agriculture.

Technical working groups from among its member-agencies will also be formed to address particular concerns relative to the implementation of this Order.

Finally, the task force will also prepare and submit to the President annual reports on the state of hunger, food security, nutrition and agricultural production in the country, as well as the task force's initiatives and recommendations.

Support and assistance of other government agencies and instrumentalities may also be sought by the task force. Meanwhile, local government units are enjoined to render necessary assistance to the task force.

Initial funding requirements for the implementation of this order will be charged against the current appropriations of the member-agencies of the task force.

However, budgetary requirements for the succeeding years will be included in the annual budget proposals of the concerned agencies.

The order takes effect immediately.

Based on the third quarter of 2019 Social Weather Stations (SWS) survey results fielded from Sept. 27 to 30, 2019, 9.1 percent or an estimated 2.3 million families experienced involuntary hunger at least once in the past three months.

The figure is lower than the 10 percent or an estimated 2.5 million in June 2019 and 9.5 percent or about 2.3 million families in March 2019.

Nograles expressed hope that fewer Filipinos will suffer from hunger with programs like the Enhanced Partnership Against Hunger and Poverty (EPAHP), an initiative to help mitigate hunger, ensure food and nutrition security, and reduce poverty in urban and rural communities, including marginalized communities.

Agencies which are a part of EPAHP are the Department of Social Welfare and Development, Department of Agrarian Reform, Department of Agriculture, the Department of the Interior and Local Government, Department of Education, Department of Health, Department of Science and Technology, Department of Trade and Industry, National Anti-Poverty Commission, National Irrigation Administration, and Landbank. (PNA)","(Presidential Photo)MANILA -- To free more Filipinos from hunger and achieve food security, President Rodrigo Duterte has created an inter-agency task force on zero hunger.
Duterte signed Executive Order 101 on January 10 creating an inter-agency task force on zero hunger which will be chaired by Cabinet Secretary Karlo Nograles.
Members of the task force include the Agriculture Secretary, Agrarian Reform Secretary, Budget Secretary, Education Secretary, Environment Secretary, Health Secretary, Labor Secretary, Interior Secretary, Trade Secretary, Science Secretary, Communications Secretary, National Economic and Development Authority Director-General, and the Commission on Higher Education Chairperson.
In the EO, Duterte recognized that involuntary hunger, food security, undernutrition, and child wasting, stunting and mortality, continue to be serious concerns in the country.
Support and assistance of other government agencies and instrumentalities may also be sought by the task force."
4,https://www.propertyweek.com/insight/designing-for-a-net-zero-future/5106217.article,"Thu, 30 Jan 2020 08:00:00 GMT",Property Week,Designing for a net-zero future,"London mayoral candidate Rory Stewart has faced a backlash after suggesting that trees should be planted on Regent Street. He tweeted that it was a “disgrace” that the historic street lacked greenery “crucial for the environment – carbon, air quality – but also for mental health and wellbeing”.

Leaving aside the debate on whether trees would spoil Regent Street’s aesthetic, or the fact that Regent’s Park is only a stroll away, Stewart is largely correct.

Placemaking, architecture and design, including biophilic design, can play crucial roles in tackling the contribution to the climate crisis of the built environment, which accounts for 40% of UK carbon emissions, according to the UKGBC.

As an industry, we must work together to cut this contribution as fast as we can. It has to feel different and difficult if we want to make a real change. Otherwise, as well as contributing to climate change, we risk assets being stranded as environmental considerations become more critical for investors, operators, developers and consumers.

Architects and designers are in a privileged position to influence investment decisions through our design advocacy. And as many of our clients hold and operate the buildings we design, there is an alignment between prioritising sustainability by designing for better building performance and using circular strategies once the buildings are in use, with an operator’s objective to reduce operational costs. Sustainability pays for itself over the long term.

One obvious way to set about this is to choose materials that ensure we’re not creating places with a short lifespan. Interiors should utilise sustainable design to reduce wear and tear. The University of New South Wales claims commercial interiors are ‘churned’ on average every five to seven years. Its research argues that materials such as bamboo, cotton and wool are known for their long-lasting qualities and can be used for designing sustainable interiors. Timber is also a popular choice, as the only truly sustainable construction material due to its ability to be regrown and its role as a carbon sink, according to University of Cambridge research.

Of course, no building should be designed in isolation from its surroundings. A holistic approach needs to be considered to create places that foster greenery and improve air quality and wellbeing.

Another way to create cleaner, more eco-friendly places to live is by making towns and cities car-free: a third of all UK carbon emissions come from transport (mainly road transport), according to the Department for Business, Energy and Industrial Strategy.

Car emissions are also detrimental to health. Shockingly, according to the World Health Organization, more than 40 UK towns and cities are above safe air pollution limits. Local authorities are starting to recognise this. At the end of last year, York City Council announced it was planning to make the city centre car-free by 2023. Brighton has recently made a similar commitment.

Designers and architects must strive to create cleaner places through effective masterplanning and use of sustainable infrastructure. They have the tools to advocate for forward-thinking solutions to the climate crisis. As an industry, we have to recognise the physical impact of what we do and start pushing for that net-zero future.

Félicie Krikler is director of Assael Architecture","Placemaking, architecture and design, including biophilic design, can play crucial roles in tackling the contribution to the climate crisis of the built environment, which accounts for 40% of UK carbon emissions, according to the UKGBC.
Interiors should utilise sustainable design to reduce wear and tear.
Its research argues that materials such as bamboo, cotton and wool are known for their long-lasting qualities and can be used for designing sustainable interiors.
A holistic approach needs to be considered to create places that foster greenery and improve air quality and wellbeing.
As an industry, we have to recognise the physical impact of what we do and start pushing for that net-zero future."
